aversion	Peña cuestiona a Luksic en el Nueragate y dice que “posee un poder y un patrimonio semejante o superior al de una agencia estatal”
ninguna	Con un eventual retorno en la mira, Sarkozy se alista para luchar en medio de batalla legal
sorpresa	Demasiado fanático: se cortó el pelo con el rostro de Messi
ninguna	Banco Central Europeo decide mantener tasas en su mínimo histórico de 0,15%
ninguna	Supremo canadiense declara constitucionales poderes para deportar extranjeros
anticipacion	Grupo de Política Monetaria recomienda al Banco Central mantener la TPM en mayo
tristeza	Nadal sufre una inesperada derrota y no entra en las semifinales de Beijing
aversion	México acusa hijo de exgobernador de encubrir capo
aversion	Senadores oficialistas en pánico: ponen presión pública al SII por denuncia que involucra a parentela de políticos con SQM
confianza	Canal 13 confirma candidatura de Jhendelyn Nuñez a reina de Viña 2015
confianza	Gasto de consumidores en EE.UU. aumenta en 0,4%, su mejor resultado desde noviembre
confianza	Lagos Weber (PPD) oficia al Mineduc para aclarar postura del Estado por Mall Barón
miedo	ONG asegura que Estado Islámico controla una área en Siria cinco veces mayor que Líbano
confianza	"Calle 13 expande su proyecto ""MultiViral"" hacia el mundo del arte"
anticipacion	Comienza el segundo día de negociaciones sobre el nuclear iraní sin muchos avances
anticipacion	Baile épico: compañía de danza se luce en Internet
confianza	EEUU sanciona a dos líderes de Al Qaeda que operan en Siria
miedo	Caída de una terraza dejó diez personas heridas en Viña del Mar
anticipacion	"Gobierno lamenta postura ""poco dialogante"" de la Alianza frente a la reforma tributaria"
anticipacion	Perú confía en que relación con España se mantendrá óptima con el nuevo rey
ninguna	O'Higgins oficializa la llegada del argentino Facundo Sava como su nuevo técnico
ninguna	Djokovic sufre ante Stepanek pero igual avanza a la tercera ronda en Wimbledon
anticipacion	Brasil se prepara para otra jornada de protestas a pocas semanas del Mundial
sorpresa	Pacman humano se come un bife de dos kilos en cinco minutos
anticipacion	"Subsecretario Micco y Reforma Tributaria: ""Chile hoy tiene espacio para llegar a acuerdo"""
ninguna	¡Ay, Bachelet!, yo me pregunto…
ninguna	Scolari ya prepara el once titular para el Mundial y sería similar al de Copa Confederaciones
confianza	Ucrania mantiene conversaciones para poner fin a la crisis, no invita a rebeldes
ninguna	El velasquismo al diván
confianza	Justin Bieber pide perdón por su broma racista
miedo	Canciller ruso asegura que Ucrania está al borde de la guerra civil
anticipacion	Bolsa de Tokio cierra a la baja mientras inversores optan por la recogida de beneficios
tristeza	Advierten que lluvia ácida podría afectar a la zona tras nueva erupción del Calbuco
ninguna	Plan de invierno en la RM: Inspeccionan trabajos de canalización del Estero Las Cruces
confianza	Guatemaltecos marchan en apoyo a defensa de Israel
miedo	Proyectiles impactan bastión rebelde en Ucrania, convoy ruso de ayuda se dirige a frontera
confianza	"Senadores piden agilizar Ley Ricarte Soto y garantizar medicamentos a enfermedades ""poco frecuentes"""
sorpresa	Menos en EEUU buscan ayuda por desempleo
confianza	Dirigentes europeos que comparecieron ante la justicia
ninguna	"Netanyahu descarta triunfo de Hamas por tregua: ""No obtuvo ninguna de sus demandas"""
aversion	Encapuchados protagonizan incidentes en las afueras del Liceo Cervantes
sorpresa	Muerte de candidato socialista provoca giro radical en escenario electoral en Brasil
confianza	Empresario peruano prófugo de la justicia es detenido en Colombia
confianza	Senador Hernán Larraín (UDI) propuso bajar sueldos de autoridades
sorpresa	El escándalo de los falsos perros guía en Estados Unidos
aversion	Mordisco de Suárez: Uruguay presentaría una foto retocada para apelar a la FIFA
ninguna	Paul McCartney y Andrew Lloyd-Webber encabezan lista de músicos más ricos del Reino Unido
tristeza	Al menos doce muertos en ataques al sur de Bagdad (responsables)
confianza	"Francisco pide a líderes de las Américas combatir ""escandalosas"" desigualdades"
tristeza	Diez palestinos muertos en ataques israelíes contra Gaza
confianza	Llegó el turismo espacial: Virgin Galactic recibe permisos para sus vuelos suborbitales
tristeza	Explosión en capital de Nigeria causó 21 muertos y 17 heridos
confianza	"El papa pide abrir los ojos ""a las miserias del mundo"" durante el Jubileo"
anticipacion	Daniela Seguel se despidió en la primera ronda del cuadro de dobles en Wimbledon
anticipacion	"Barroso defiende una ""gran, gran coalición"" en la UE para los próximos 5 años"
alegria	"Españoles del City le temen a Chile: ""Preferíamos otro rival"""
ninguna	Israel asegura que fue Holguín quien canceló la visita a Ramala
aversion	Hijos de: incesto y moral en la clase política chilena
aversion	Uribe no acude a citación de Fiscalía por denuncias contra campaña de Santos
tristeza	Nuevos enfrentamientos en Gaza provocan muerte de seis civiles y un miliciano palestino
anticipacion	BBC: ¿Cuándo despegarán las aerolíneas de bajo costo en América Latina?
anticipacion	NSA contradice a Snowden y asegura que él nunca hizo críticas cuando estuvo en la agencia
anticipacion	Holanda estudia opción de utilizar una línea de cinco defensores en el Mundial
aversion	"Lugano: ""Si Chiellini acusó a Suárez, es alcahuete y llorón"""
tristeza	"Asociación de Futbolistas inglesa dice que Suárez debe tratarse ""problemas de salud mental"""
anticipacion	Anunciaron temperaturas bajo cero para este viernes
anticipacion	Operadores financieros mantienen previsión de inflación de 0,2% en junio
ninguna	Bastián Malla cayó en los octavos de final del Futuro 4 de Colombia
aversion	NY: Arrestan a hombre que grabó muerte en arresto
anticipacion	Pérdidas de Malaysia Airlines aumentan 59%
sorpresa	Arribo de turistas a Chile crece sólo 0,6% por menor llegada desde Argentina y Brasil
confianza	PDI de Valparaíso arresta a sujeto imputado de abusar de menores de edad
ninguna	Fox Sport alista estreno en latinoamérica de nuevo programa de deporte de combate
ninguna	Esposa de Humala viajará a China como presidenta del partido Nacionalista
tristeza	Muere Jacinto Convit, el médico venezolano que inventó una vacuna contra la lepra
confianza	Penalistas destrozan sentencia que dejó a O’Reilly con libertad vigilada por abuso sexual contra una menor
tristeza	Israel refuerza con reservistas la frontera con Gaza entre temores de violencia generalizada
confianza	Documental revela la heroica huelga de obreros escoceses que se negaron a reparar los aviones que bombardearon La Moneda
aversion	Belisario Velasco dice que Martínez hizo discurso propio de la Guerra Fría y que la Junta DC fue manejada discrecionalmente
confianza	Ministro de Agricultura destaca plan de apoyo para combatir la sequía en la Región de Coquimbo
anticipacion	Conoce cómo ha sido la evolución de Godzilla en el cine
sorpresa	Conoce la cafetería de California que ofrece compañía felina
ninguna	Castillo es titular en nuevo triunfo del Brujas y Albornoz sigue ganando terreno en el Hannover
confianza	Policía arresta a cuatro hombres por la lapidación de una mujer en Pakistán
confianza	"Gobierno argentino: ""Cuando empecemos a pagarle al Club de París, los países volverán a invertir"""
aversion	Sampaoli y la trastienda de la guerra publicitaria mundialera entre el Banco de Chile y el Santander
ninguna	Monckeberg se transforma en nuevo presidente de RN y dice representar a la “auténtica derecha que hoy está más viva que nunca”
aversion	"PS advierte que crítica a labor de la Fiscalía puede ser ""nefasta"" para la clase política"
confianza	LG entrega nuevos detalles de su reloj inteligente y anuncia tres nuevas tabletas
aversion	Tuiteros critican nueva protesta de Roxana Miranda
confianza	Cómo será el Mapocho 42K: cada ciclovía tendrá tres metros de ancho y será de asfalto rojizo
confianza	Cementerio General inaugura ruta histórica patrimonial para colegios
alegria	El milagroso rescate de un perro que sobrevivió 18 horas bajo tierra
confianza	"Miiko Albornoz en su llegada a Chile: ""Es un honor estar entre los 30"""
sorpresa	El Chascas dedica libro de cuentos al sida
tristeza	Un muerto y dos detenidos en frustrado asalto a camión de valores en Chile
confianza	Australia pide a Sudán liberar la cristiana condenada a muerte por apostasía
anticipacion	México defiende ante la ONU la prevención como fórmula contra la violencia
confianza	Cámara de Diputados aprueba en particular 'corazón' de la reforma tributaria
ninguna	"Romero se despide del primer equipo azul: ""Lamentablemente terminamos mal"""
tristeza	Madres centroamericanas están en callejón sin salida en EEUU, según abogados
ira	Las platas que salieron del Arcis para lucro cuando el PC controlaba la universidad y el rol del actual subsecretario de Previsión Social
ninguna	Marfán y Velasco destacan tono de acercamiento del Gobierno en debate por Reforma Tributaria
confianza	Arrestan a peligroso delincuente acusado de homicidio en La Legua
anticipacion	PIB de la OCDE aumenta un 0,2% en el primer trimestre impulsado por consumo privado
ira	Activistas de la causa indígena realizan tercer ataque incendiario en menos de 48 horas
confianza	Lavrov y Kerry piden investigación sin trabas y entrega de las pruebas
confianza	Tribunal Constitucional ordena levantar bloqueo de Youtube en Turquía
ninguna	El Tata Martino le dijo no a River y ahora van por el Muñeco Gallardo
confianza	Las luces de Broadway se atenuarán hoy para llorar a Lauren Bacall
sorpresa	30 millones de usuarios de Facebook… ¡están muertos!
anticipacion	Los sitios de Internet más visitados y poderosos del mundo
ninguna	Fiscalía pide tramitar extradición de Flores
anticipacion	Adimark: más del 70% de la población apoya cambiar la Constitución y la despenalización del aborto
anticipacion	EEUU: Ley de desactivación de teléfonos celulares
confianza	"Marcelo Díaz: “Vidal y Medel son tipos que merecen toda la admiración de Chile"""
ninguna	Óscar Landerretche golpea la mesa en directorio de Codelco
anticipacion	Dólar termina sesión a la baja influenciado por el mal dato del PIB de Estados Unidos
ninguna	"Canciller Muñoz defiende ""convergencia"" entre el Mercosur y la Alianza del Pacífico"
confianza	EEUU dice que confía en que seguirán teniendo cooperación espacial con los rusos
confianza	Cumbre de las Américas: Santos asegura que espera lograr acuerdo con las FARC este año
sorpresa	Avión de Bono pierde su escotilla trasera en pleno viaje a Berlín
anticipacion	Federación de Trabajadores del Cobre rechaza cuestionamientos a nuevos directores de Codelco
confianza	Científicos crean sistema para pilotear aviones solamente con la mente
aversion	Trabajadores de farmacias denuncian nuevo tipo de colusión en grandes cadenas del rubro
sorpresa	Hombre busca novia en Facebook y lo rechazan 5 mil mujeres
ninguna	UDI niega renuncia formal de alcalde Carter y lo llama a reflexionar
aversion	Un grupo de apoderados del Instituto Nacional protestó frente al Municipio de Santiago
anticipacion	"Nobel de Literatura nigeriano califica de ""seres infrahumanos"" a integrantes de grupo islamista"
ninguna	Johnny Depp sorprende con radical cambio de look para su nueva película
ninguna	"Johnny Depp y Kate Mara se pasan a la ciencia ficción extrema en  ""Transcendence"""
ninguna	El día de Europa
anticipacion	"Bachelet y nuevo pulso del Calbuco: ""No descansaremos para atender esta emergencia"""
ninguna	"Marruecos ""asombrado"" por decisión de un juez español sobre Sáhara Occidental"
anticipacion	México y Guatemala han deportado 4.905 menores hondureños desde enero
anticipacion	Chile sufre un gran atraso en materia de Derechos Digitales, según expertos
confianza	Personal de Carabineros indaga crimen de un hombre en la comuna de La Calera
confianza	"Obama: EEUU ""no será prisionero del pasado"" con Cuba ni con la región"
confianza	"Viuda del cabo Moyano: ""Estoy tranquila porque se hizo justicia"""
sorpresa	Alitalia confirma suspensión de vuelos a Venezuela
anticipacion	Cinco consejos para el día del Maratón
confianza	Los responsables del apagón en el norte arriesgan multas de hasta $5 mil millones
confianza	Maduro llegó a Nicaragua para festejo de revolución sandinista
anticipacion	Excedentes de Codelco caen a US$ 539 millones en el primer trimestre por baja del cobre
aversion	Santiago Pavlovic y su camarógrafo fueron agredidos en Ucrania
miedo	Bus interprovincial se incendia y obliga a evacuar a sus pasajeros en Curacaví
confianza	"La CUT por salario mínimo: ""Estamos en un buen pie para enfrentar esta negociación"""
confianza	Universitarios hispanos abogan por protección de parques nacionales de EEUU
anticipacion	Sismo de 5,0 sacude costa sur de México sin dejar daños ni heridos
ninguna	Película sobre Grace Kelly decepciona a la crítica a pocas horas de inaugurar Cannes
ninguna	Conmebol anuncia que Jamaica participará en la Copa América Chile 2015
ninguna	"Actor venezolano protagonizará la nueva versión de la cinta ""Punto de Quiebre"""
confianza	Heraldo Muñoz condena los ataques “desproporcionados” de Israel en Gaza y reclama una tregua inmediata
ninguna	La venta de Recalcine y su proyección nacional
ninguna	Consejo del BC solo evaluó la opción de mantener TPM en 3% en reunión de marzo
confianza	El Ejército francés libera en Mali a un holandés secuestrado en 2011
confianza	"El Toto Berizzo fue presentado en el Celta: ""Decidirme a venir me demoró tres o cuatro minutos"""
confianza	UE y EEUU acercan posturas en protección de datos tras la crisis de escuchas
anticipacion	Ucrania revela que escisión de Crimea causó pérdidas por más de 100 mil millones de dólares
anticipacion	Hogar de Cristo reunió el 13% de los socios que se necesitan en la Región Metropolitana
anticipacion	Billboard asegura que versión chilena de Lollapalooza es el evento más lucrativo del año
confianza	Ecuador enviará 20 toneladas de ayuda humanitaria a Gaza a través de Egipto
tristeza	Mueren cinco personas en repunte de violencia en estado mexicano de Michoacán
ninguna	Rifirrafe entre agentes de seguridad y periodistas en inicio de jornada
sorpresa	La Calera: Formalizan a abogada por inducir a desacato
tristeza	Cinco muertos en protestas de Hermanos Musulmanes en aniversario masacre en El Cairo
anticipacion	Bachelet designa nuevo presidente para cuprífera estatal Codelco
sorpresa	Ex sacerdote jesuita es detenido por porte de arma de fuego
aversion	Declaran culpable a concejal RN por abusos sexuales a hijas
confianza	Víctor Pérez (UDI): 'Una adecuada política indígena no se basa sólo en tierra y más burocracia'
confianza	"Putin manifiesta a Merkel y Hollande su ""preocupación"" por las víctimas civiles de Ucrania"
anticipacion	Messi marca un doblete y Argentina gana su grupo del Mundial con tres triunfos
aversion	La tentación de La Moneda para regresar a la política de hermetismo comunicacional
anticipacion	Oficialismo Ecuador presenta reformas a Constitución para reelección indefinida
alegria	Dólar abre sesión estable ayudado por el buen desempeño del cobre
confianza	"La revista ""Rolling Stone"" ofrece disculpas por polémico artículo sobre violación"
anticipacion	Analizan que exista un cuarto cambio en los alargues de los partidos
ira	Bolivia distribuyó relojes con la demanda marítima a grupo de países en vías de desarrollo
confianza	Aseguran que Manchester United realizó una oferta formal por Arturo Vidal
anticipacion	Proyecto de Reforma Tributaria será visto por la Sala del Senado la próxima semana
confianza	EEUU sanciona personas y empresas de A.Latina vinculadas a red lavado dinero
ninguna	Las claves de la llegada de Andrés Palma al Mineduc y la operación para neutralizar a Walker
aversion	Intentaron sacar cocaína impregnada en calcetines y un pijama de niño
sorpresa	Gobierno argentino cuestiona a Poder Judicial tras criticas de juez supremo
confianza	Puerto Valparaíso dona contenedores para jardín de emergencia en zona afectada por incendio
confianza	"Oposición venezolana espera cancilleres de Unasur para ""desatrancar"" diálogo"
anticipacion	Propietarios de armas de fuego inscritas podrán consultar su estado vía Internet
confianza	Corte Suprema rechaza recursos presentados por SQM en contra de sentencia del Tribunal Ambiental
aversion	Triángulo terrestre: Perú avanza en su estrategia por recuperar territorios anteriores a la Guerra del Pacífico
confianza	Sampaoli confirmó que la próxima semana Vidal entrenará en cancha y que harán nuevo examen a Valdivia
anticipacion	Huelga bancaria en Argentina afecta atención al público y recorta negocios
ninguna	"F-1: Rosberg firmó la ""pole"" y Alonso saldrá séptimo en Hockenheim"
confianza	Nueva York inaugura museo 11-Setiembre en presencia de Obama
confianza	Fernández retoma agenda pero no viaja a cita de G-20 por prescripción médica
ninguna	"Cuba dice que multa de EE.UU. a BNP Paribas es un ""atropello"" al derecho internacional"
alegria	Alberto II y Charlene de Mónaco anuncian que esperan su primer hijo
tristeza	Cerati: Hoy se cumplen cuatro años del accidente vascular que lo mantiene en coma
aversion	Atentado con coche bomba deja al menos 29 muertos cerca de frontera entre Siria y Turquía
confianza	"Francisco Saavedra estrena nuevo ciclo de  ""Lugares que hablan"": ""Es un aporte a la TV"""
miedo	Bombazos y asaltos: las frenéticas 24 horas del gobierno en seguridad pública
confianza	Evasión: 27 personas fueron a la cárcel en el 1º trimestre del año por no pagar pasajes en buses
ninguna	Ponce Lerou: la solución final de las elites
confianza	"Arturo Vidal: ""Espero llegar al primer partido del Mundial"""
sorpresa	El reloj del Congreso de Bolivia gira sus agujas hacia la izquierda
ira	Indignación en Turquía por asesor de Erdogan que patea a manifestante en mina
ninguna	Acuñan 3 millones de monedas con Carlos V como el primero en proponer canal
anticipacion	Acciones de Pampa Calichera caen cerca de 20% y lideran las bajas en la Bolsa
aversion	Justicia Militar otra vez en la mira: critican sentencia de tres años de libertad vigilada para carabinero que asesinó a Manuel Gutiérrez
tristeza	"Murió ""el feo"""
anticipacion	Eyzaguirre se reúne con senadores DC y aborda detalles de reforma educacional
ninguna	Barnechea se despide de la Primera División con un ajustado triunfo sobre Palestino
tristeza	Tragedia en Turquía: Gobierno confirma 282 muertos y posibilidad de rescate es casi nula
ninguna	Resultados y programación de la decisiva última fecha del Clausura
sorpresa	"El doc de ""Volver al Futuro"" y Black Canary de ""Arrow"", pasearon por La Moneda"
anticipacion	RN y PS abordan reformas políticas y constitucionales en cita entre sus directivas
confianza	Miles de israelíes se solidarizan con las comunidades del sur atacadas
confianza	Feria del Libro de Madrid quiere contagiar a los jóvenes la pasión por leer
confianza	"Chileno de ""Game of Thrones"" comienza a grabar serie sobre Pablo Escobar para Netflix"
anticipacion	El hombre que quiere vestir al mundo con flechas y diamantes
anticipacion	La elite conservadora  tras las clínicas de la Cámara de la Construcción que se oponen a la ley de aborto
ninguna	"Compañía turística china demanda a productores de ""Transformers 4"""
aversion	ENAP: Bencinas volverán a subir hasta $9,7 por litro a partir de este jueves
confianza	"Fiscal Nacional: ""Pesquisas por robo en Aeropuerto pueden tener importantes resultados"""
anticipacion	ACES acusa haber sido marginada de marcha convocada por Colegio de Profesores
confianza	Profesores y estudiantes marchan por la Alameda
confianza	Van a intervenir los 10 recorridos críticos del Transantiago y fiscalizarán la frecuencia nocturna
confianza	Presidente cubano Raúl Castro recibe al líder saharaui Mohamed Abdelaziz
ninguna	"Gobierno se reúne con Asoex y Vinos de Chile para evaluar control de ""Lobesia Botrana"""
confianza	Telekom Austria y América Móvil expanden red para clientes mayoristas
tristeza	Un niño de dos años murió atropellado por un camión de gas en Peñalolén
ninguna	Periodista ucraniano que agredió a Brad Pitt enfrenta posible sentencia de cárcel
tristeza	"Fallece participante australiano de ""American Idol"""
ninguna	Diputados DC rechazan eventuales concesiones de parques nacionales por parte del MOP
ninguna	Karol Cariola: “El proceso constituyente ya partió”
confianza	Reclaman una educación inclusiva para los indígenas guatemaltecos
anticipacion	Núñez (RN) pide pronunciamiento de Contraloría por nombramiento de nuevos directores de Codelco
ninguna	La arremetida de La Moneda para aterrizar la Reforma Educacional y ganarle el gallito comunicacional a la derecha
anticipacion	EEUU pide incluir a todas las partes en diálogo nacional en Ucrania
ira	Experto asegura que delitos informáticos cuestan al mundo 113.000 millones de dólares
aversion	Encapuchados ingresaron al Barros Borgoño pese a que la toma había terminado
anticipacion	Qué piensa “Construye Sociedad”
confianza	Iberia logra contundente triunfo en su regreso a la Primera B
confianza	Ansiado museo de George Lucas será construido en Chicago
alegria	Escritor nacional Óscar Hahn se alza como ganador en los premios Loewe de Poesía
confianza	Empresario peruano Orellana, prófugo de la justicia, es detenido en Colombia
ira	Niño de 10 años hizo amenazas de bomba contra avión belga en República Dominicana
ninguna	Productora de concierto de Miley Cyrus en República Dominicana acata prohibición del show
ninguna	Fabrican destapadores inspirados en Luis Suárez y su mordisco a Chiellini
confianza	Las claves del programa propedéutico para el ingreso de estudiantes más vulnerables a la Educación Superior
anticipacion	Fin de semana largo: se espera que 270 mil vehículos salgan de Santiago
anticipacion	"Refuerzan seguridad en aeropuertos británicos por una amenaza de terrorismo ""creíble"""
anticipacion	Presentan requerimiento contra Eyzaguirre en la Contraloría
ninguna	"Julio Iglesias se rinde a los pies de Conchita Wurst : ""Es una súper cantante"""
anticipacion	Van Rysselberghe pide al gobierno medidas urgentes para solucionar crisis hospitalaria
ninguna	Angelina Jolie y Brad Pitt arriban a Malta para iniciar el rodaje de su nueva película
anticipacion	Revise las selecciones que han entregado hoy sus nóminas definitivas para el Mundial
tristeza	Incendio destruye siete casas y deja 25 damnificados en La Pintana
sorpresa	Dólar cerró al alza presionado por negativo escenario externo
ninguna	"Secretario de Defensa de EE.UU.: ""Los rusos van a ser los grandes perdedores"""
anticipacion	La “democracia directa” según Carolina Tohá
anticipacion	Economista Fontaine por reforma tributaria: 'Los efectos sobre la economía ya se están sintiendo'
anticipacion	"Participantes en cumbre sobre el Sida en Australia siguen ""en shock"" por tragedia de avión"
miedo	Cómo Reino Unido enseñó a los militares brasileños a torturar
confianza	Justicia francesa condena a cinco años de cárcel a un ciberyihadista marroquí
ninguna	El papa llama a la conversión de criminales y corruptos durante el Jubileo
ninguna	Escucha los primeros balbuceos de esta hermosa bebé
miedo	Milicias palestinas dispararon hoy más de 70 cohetes contra Israel
anticipacion	Mineduc anuncia que incorporará a las distintas agrupaciones en elaboración de próximas reformas
ira	Vice Presidente argentino declarará ante la justicia por acusaciones de corrupción
sorpresa	Falla en Siri permite desbloquear iOS y hacer llamadas
tristeza	Mueren seis monos en zoológico de Oregon
ninguna	"Perú destaca su ""seriedad"" y crecimiento sostenido para atraer inversiones extranjeras"
ninguna	Robert Pattinson abre su intimidad y sorprende con austero estilo de vida
ira	Mansuy:  “Los colegios donde estudian los hijos de quienes han pensado esta reforma pueden lucrar, seleccionar y cobrar”
ninguna	"Cabello dice diálogo en Venezuela ""no está subordinado"" a presencia oposición"
confianza	Estudiantes de U. del Mar destacan a artista visual que quemó sus pagarés de deuda
ninguna	"Badenier y reclamación de Hidroaysén: Decisión del Comité de Ministros ""fue la correcta"""
alegria	Liberan a niña colombiana hija de un policía que había sido secuestrada
sorpresa	"Gobierno argentino denuncia ""campaña"" en su contra por inseguridad"
anticipacion	Enfrentamientos en París entre la policía y los manifestantes propalestinos
sorpresa	Modelo argentina y Google confrontan posturas en audiencia de Corte Suprema
confianza	Gobierno respalda a viuda del cabo Moyano tras condena de asesino
sorpresa	"¿Faltarán 48 años aún? Sevilla gana la Europa League y alarga ""maldición"" de Benfica"
anticipacion	"Zaldívar pide realizar una revisión ""de fondo"" del impuesto a los combustibles"
tristeza	Mueren cuatro talibanes en un ataque con avión no tripulado en Afganistán
confianza	El presidente Correa recortará la jornada laboral del miércoles por el partido Ecuador-Francia
confianza	Presidenta Bachelet firma balón en respaldo a la campaña mundial de ONU SIDA
confianza	Diputado Walker y reforma tributaria: Por parte de la DC van a estar todos los votos
tristeza	"Eli Wallach, el ""feo"" más popular del cine, fallece a los 98 años"
ira	Demi Lovato revela que su abuelo era homosexual
ninguna	Alemania coloca bonos por US$ 2.734 millones a seis meses
tristeza	Joven de 17 años acusado de disparar contra compañeros de escuela en Atlanta
confianza	Carabineros arresta a dos sujetos que asaltaron supermercados en Macul
sorpresa	Conoce todas las prenóminas de las selecciones que participarán en Brasil 2014
ninguna	Estos son los mejores memes de la abdicación del rey
