tristeza	Al menos dos policías muertos y cinco heridos en emboscada guerrillera en Perú (policía)
confianza	Rey Juan Carlos preponderante en la vinculación con Iberoamérica (presidente de Honduras)
confianza	La Real Sociedad agradeció el compromiso y profesionalismo de Claudio Bravo
confianza	Cher es reconocida por su trabajo en favor de los portadores de VIH
alegria	"Enamorados recrean escenas de ""Diario de una pasión"" para celebrar su compromiso"
ninguna	La vida del abogado que tiene entre las cuerdas a Los Pelambres
ninguna	Juncker aspira presidir Comisión, institución que declinó pilotar en 2004
confianza	"Aerolínea brasileña Gol reinicia vuelos a Chile con modelo de negocio de ""bajos precios"""
anticipacion	Presidentes de clubes que deseen ir al Mundial deberán pagar más de $2 millones a la ANFP
aversion	Ciudad sede del Mundial sufre una ola de saqueos en medio de la huelga policial
anticipacion	Pintura de Warhol casi fracasa en subasta y finalmente se vende en 9,3 millones de dólares
confianza	eBay lanza sitios en español y portugués para aumentar ventas en A. Latina
sorpresa	Cartuchos extremos: escuela de Utah photoshopea anuario para que alumnas muestren menos piel
tristeza	México: se mantienen las protestas y críticas a Peña Nieto por el caso de los 43 estudiantes normalistas desaparecidos
ninguna	Aplazada hasta octubre la VIII Cumbre de Unasur por cuestiones de agenda
aversion	Desconocidos roban psicotrópicos desde un centro de salud mental en Osorno
ninguna	Los números de Bofill en el 13: últimos tres meses en el cuarto lugar del rating
ninguna	Agenda internacional del jueves 28 de agosto
confianza	Piñera emplaza al gobierno a que “en lugar de enviar a cinco ministros a descalificar, aprenda a escuchar”
confianza	Energía obtenida del viento: Investigador chileno estudia cómo reducir costos de generación
anticipacion	Líder prorruso pide unión de la región ucraniana de Donetsk con Rusia
confianza	Rápidos y furiosos 7 cumple con los pronósticos y arrasa en la taquilla internacional
sorpresa	Seis homosexuales marroquíes condenados a penas de hasta 3 años de cárcel
ninguna	El presidente iraquí Talabani, un mediador pragmático
aversion	Cura Joannon sigue sin pedir perdón a las víctimas a un mes de vencido el plazo
ninguna	Spurs toman ventaja 3-2 y podrían definir la final del oeste este sábado
tristeza	Adolescente muere atropellado mientras rayaba bus con spray en Quinta Normal
confianza	Argentinos se preparan para masiva marcha por muerte de fiscal
sorpresa	Aerosmith cancela concierto en Californa por problemas cardíacos de su baterista
confianza	"Yoani Sánchez lanzará el 21 de mayo ""14ymedio"", su nuevo periódico digital"
confianza	"EEUU exhorta a Ucrania a mostrar ""mesura"" frente a los rebeldes"
ninguna	Cielo nublado y 13 grados se prevé para este jueves en la capital
anticipacion	Presentan al primer orangután más puro genéticamente de América
anticipacion	Brasil niega que Snowden realizara un pedido formal de asilo
miedo	FARC advierten que quien rompa proceso de paz pagará un coste político enorme
anticipacion	Lagos: el partido del orden ya tiene candidato
ninguna	Del Bosque mantiene la confianza en Piqué y Diego Costa en nómina de España
sorpresa	Más de 300 mil chilenos tienen su cédula de identidad vencida: vigencia dura hasta el 30 de septiembre
confianza	Canciller panameña pide reducir tensiones entre EE.UU. y Venezuela
ninguna	Programación de la 15ª fecha de la Primera B
anticipacion	El orangután más puro genéticamente de América vivirá en Chile
sorpresa	"Astrónomos descubren al ""Godzilla"" de los planetas que orbitan estrellas lejanas"
ninguna	Ojo de Halcón se estrenará en la final de la Copa Italia entre la Juventus de Vidal y la Lazio
anticipacion	Baja adhesión en marcha tras paro fallido del Transantiago
confianza	Meteorología confirma que en las próximas horas comenzará a llover en la cima del volcán
miedo	Irak: ¿es solo extremismo lo que alimenta a ISIS?
ninguna	Matthews se mantiene al frente de un lluvioso Giro
confianza	Inauguran exposición que rescata los 135 años de las telecomunicaciones en Chile
anticipacion	Diputada Sabat solicita explicaciones al Gobierno por cancelación de Fono de atención y apoyo a la Maternidad
ninguna	Supremo de EEUU rechaza el caso de Alan Gross contra el Gobierno
ninguna	"Manga ""Ataque a los titanes"" llegará a la televisión nipona en acción real"
alegria	Manuel Pellegrini, el “encantador” que hizo historia en el fútbol inglés
anticipacion	Descubrimiento de una estrella entrega datos sobre el origen de los misteriosos magnetares
anticipacion	"Filtran imágenes de la filmación de ""Star Wars"" Episodio VII"""
aversion	"Andrade por dichos de Evo Morales: ""Él construye enemigos, es como el matón del barrio"""
confianza	España condena la lapidación de una mujer embarazada en Pakistán
aversion	El presidente de RN tras la reunión con Bachelet: “Nos inquietan las negociaciones paralelas”
alegria	Dólar se transa a la baja ante positivo desempeño de mercados externos
ninguna	"Gerardo Martino fue presentado en la selección argentina ""donde siempre quise estar"""
confianza	Cobre extiende avances y alcanza su mayor nivel en más de 4 meses
tristeza	Fin de semana largo termina con 20 personas fallecidas en accidentes de tránsito en el país
anticipacion	"Jefe de propaganda de Tíbet promete ""sellar"" internet para frenar a separatistas"
ninguna	Inédito acuerdo en el sector Salud para flexibilizar los requisitos de la prueba Eunacom
confianza	Felipe Aguilar cierra bajo el par la primera jornada del Nordea Masters en Suecia
anticipacion	La selección española grabó un video de su concentración con Google Glass
ninguna	Bachelet: el valor de la derrota
confianza	Servicio de Salud Arica realiza operativos en terreno atendiendo usuarios con problemas de visión
anticipacion	Acciones de Latam Airlines anotan fuerte caída tras inesperadas pérdidas el primer trimestre
anticipacion	Squella (UDI): Aprobación en bloque de reforma tributaria ilustra falta de diálogo del Gobierno
anticipacion	Intendencia decreta alerta ambiental para Santiago
tristeza	Asesinato de joven chilena en Argentina: sospechoso es investigado como atacante serial
ninguna	"Obama cree que Hillary Clinton sería ""muy eficaz"" como presidenta"
anticipacion	"Andrade espera que senadores oficialistas den un respaldo ""unívoco"" a la reforma tributaria"
tristeza	Carles Puyol, el gran líder le dice adiós al Barcelona y camina hacia el retiro
ninguna	"Protagonista de ""The Vampire Diares"" revela qué haría si fuera realmente un vampiro"
sorpresa	Llega a Ecuador, acusado de violación, el padre del vicepresidente del país
tristeza	Actualización Permanente: Colegio de Profesores inicia marcha en el marco del paro nacional
sorpresa	Falso aviso de bomba obliga evacuación de colegio Hebreo de Viña del Mar
confianza	Ministro Undurraga inspecciona obras del Plan de Invierno en el Gran Santiago
ninguna	CorreosChile presenta oficialmente la estampilla del Mundial de Fútbol 2014
anticipacion	Maduro anuncia que Sánchez Arveláiz irá como encargado de negocios a EE.UU.
aversion	Bachelet pide no “linchar” y destruir la honra de nadie antes de tiempo por arista SQM
anticipacion	Astronautas de la EEI vuelven a la Tierra en medio de tensión entre Rusia y EE.UU.
anticipacion	Catar anuncia reformas para permitir a inmigrantes salir del país sin permiso
ninguna	Las defensas morales del senador UDI Hernán Larraín
confianza	Israel anuncia 7 horas de tregua en Gaza tras el ataque contra escuela de la ONU
sorpresa	Diseñaron un gorro que permite pilotar aviones con la mente
ira	Empresa Argentis rechaza imputaciones por filtración de datos de adopciones desde el Sename
anticipacion	Sismo de 5,5 grados Richter se registró en Región de Antofagasta
confianza	EE.UU. pide a Ucrania ejercer la contención para evitar víctimas civiles
miedo	Artefacto sospechoso cerca de la Cancillería causa alerta e interrupciones en el tránsito
ninguna	La crisis política búlgara cierra en falso con el esperado regreso de Borisov
anticipacion	Mundial al día: Brasil se relaja antes de duelo con Colombia
sorpresa	Indígenas amazónicos en histórico juicio en Perú por muerte de policías
confianza	"Colombia llama a ""reaccionar en cadena"" contra la trata de personas"
sorpresa	"Eliseo Salazar: ""Cinco minutos en el podio valen tres meses en el hospital"""
anticipacion	Dirigente de la Fenats llama al Gobierno a expropiar hospitales concesionados
alegria	Venezuela: Alcalde Ledezma recibe alta médica y es trasladado a su casa
anticipacion	La OTAN aprueba el plan de operaciones de la futura misión en Afganistán
confianza	Imacec de febrero anota incremento de 2% y se ubica en línea con las expectativas
confianza	Presidente hondureño y embajador Kuwait en México dialogan sobre cooperación
aversion	Justin Bieber es citado a declarar por la justicia argentina en caso de agresión
confianza	Presunto miembro de las FARC buscado por la Interpol arrestado en Ecuador
ninguna	Barrick refuerza equipo de Pascua-Lama y nombra a ex Codelco como director ejecutivo
anticipacion	Lanzan al mercado el escáner más pequeño del mundo
ira	Directora del INDH: Fichas de Colonia Dignidad carecen de datos relevantes sobre DD.HH.
anticipacion	Reforma tributaria es debatida y votada este martes y miércoles en la Cámara de Diputados
ninguna	Bosnia celebrará elecciones generales el 12 de octubre
ninguna	El ELN cumple mañana 50 años entre la guerra y la paz
tristeza	Explosiones de coches bomba en Bagdad dejan al menos 18 muertos y 59 heridos
anticipacion	Director de cinta sobre popular rockero estadounidense es acusado de accidente fatal en el set
confianza	Piden retirar inmunidad a dos juezas en Guatemala
confianza	Tasa de desempleo en el Reino Unido baja a su máximo en cinco años
confianza	Sánchez Cerén mantendrá base de vigilancia antidrogas EE.UU. en El Salvador
confianza	Mejores alumnos de colegios vulnerables tendrán cupo asegurado en cinco universidades
anticipacion	Diputado RN critica a titular de Salud por no asistir a sesión de la Cámara por crisis hospitalaria
ninguna	"Protagonistas de ""The Last Ship"" analizan el éxito de la serie y la ventaja del ""sello Bay"""
confianza	Jamaica y México son confirmados como selecciones invitadas a la Copa América 2015
aversion	"Berlusconi se indigna por el ""complot"" internacional en su contra revelado en un libro"
confianza	Ampliación del Aeropuerto marca el Plan de Infraestructura nacional anunciado por Bachelet
anticipacion	Ucrania paga parte de deuda a Gazprom sin llegar a acuerdo definitivo con Rusia
anticipacion	Qué esperar de la conferencia Google I/O 2014: El futuro está en Android
confianza	El arquero chileno Lawrence Vigouroux firmó por el Liverpool
aversion	Alumnos del Instituto Nacional decidieron respaldar la toma como forma de movilización
confianza	"Roberto Echeverría y su desafío en el MDS: ""Vengo a ganar"""
aversion	Facción islámica secuestra a 300 civiles kurdos en el norte de Siria
confianza	Canal del Fútbol cede y abre espacio a medios digitales para que exhiban jugadas y goles del torneo nacional
anticipacion	"Activista nicaragüenses denuncia que las cifras de paridad son ""maquillaje"""
sorpresa	Hallan en Malasia diente de dinosaurio de hace 140 millones de años
confianza	Desempleo en EE.UU. se ubica en 6,1% tras creación de 288 mil empleos en junio
confianza	Centro de investigación de la UCSC realizará estudio en el Borde Costero de Atacama
anticipacion	Bolsas europeas toman un respiro y cierran 'mixtas'
ninguna	Holanda entrena ante 5 mil personas y ensaya oncena titular para Mundial
confianza	iPad permitirá trabajar en varias apps al mismo tiempo
anticipacion	"Bachelet tras críticas a la reforma: ""No queremos terminar con los colegios subvencionados"""
confianza	Putin y Tsipras firman Plan de Acción de cooperación económica 2015-2016
anticipacion	Dólar cerró a la baja por aumento en la oferta de empresas mineras
ninguna	Gisele Bündchen habla de su retiro tras ser la modelo mejor pagada de la historia
ninguna	Argentina entra en default por segunda vez en 13 años
miedo	"La UA está ""preocupada"" por los ataques contra sus tropas en R.Centroafricana"
anticipacion	"Ministra de Salud: ""No estamos promoviendo que las mujeres se hagan un aborto"""
tristeza	Terremoto en Nepal: Autoridades aumentan cifra de muertos a más de 6.000
aversion	RN critica ausencia de autoridades en seminario de víctimas de la violencia en La Araucanía
confianza	Honduras debe priorizar combate contra violencia infantil (CIDH)
anticipacion	Batman v Superman: Dawn of Justice lanza su primera imagen oficial
confianza	"Gendarmería por procesos sumariales: ""Las situaciones no resueltas serán revisadas"""
anticipacion	Dólar retrocede ante mayor contracción de la economía estadounidense
confianza	Comienza marcha de profesores chilenos con apoyo de estudiantes
tristeza	Incendio destruye siete casas y deja 25 damnificados en La Pintan
aversion	De Mussy (UDI): 'Nueva Mayoría y el propio Gobierno le hicieron un flaco favor a la Presidenta'
confianza	La OMS pide el apoyo político de los dirigentes africanos contra el ébola
anticipacion	"Monckeberg critica aprobación de la reforma tributaria: ""El Gobierno quería dar un portazo"""
anticipacion	Airbus y Airfrance se enfrentan por causas del mortal vuelo AF447
ninguna	"Hamilton no se confía ante Ferrari en GP de China: ""El trabajo aún está por hacer"""
ninguna	NBA: San Antonio aplasta a Oklahoma City y queda a un triunfo de la final
confianza	Brazo robótico controlado con contracciones musculares es aprobado para la venta
aversion	Intendente de La Araucanía pone presión al gobierno por huelga de comuneros mapuche
confianza	Bolsa de Santiago cierra estable en víspera de feriado religioso
confianza	Ucrania mantiene alto al fuego a pesar de ataque a helicóptero (canciller)
anticipacion	Bancada RN exige a Huenchumilla trato igualitario a víctimas de violencia en La Araucanía
ninguna	Nacionalistas catalanes acuerdan mantener consulta soberanista de noviembre
tristeza	En España insisten en que Carles Puyol anunciará mañana su retiro como jugador
sorpresa	Los impresionantes edificios bajo tierra en Ciudad de México
ninguna	Guillermo Teillier y Karol Cariola se reunieron con Raúl Castro en La Habana
aversion	Rusia no negociará rebajas de gas hasta que Ucrania no pague deudas
anticipacion	Bachelet, la generación de los sobrevivientes  y la “Orquesta Roja”
confianza	Nueva York inaugura museo del 11-S a casi 13 años del atentado a las Torres Gemelas
aversion	"Eto'o califica a Mourinho de ""títere"" por cuestionar su edad"
ninguna	Diputado Jiménez valora mesa de trabajo por cierre del comercio los domingos a las 17 horas
confianza	Inminente fichaje de Bravo en Barcelona: el arquero logró que la Real no cobre al cláusula
confianza	"Hernán Larraín: ""Pedimos disculpas, pero también justicia"""
confianza	Traductor de El Quijote al quechua fue condecorado por descendientes de Incas
ninguna	Barghuti aplaude la reconciliación y dice que el retorno es irrenunciable
confianza	Los libios votan para salir de la crisis en un clima de relativa calma
anticipacion	Celestino Córdova fue trasladado a hospital de Nueva Imperial tras fin de huelga de hambre
sorpresa	"Samsung Electronics admite que perspectivas para el segundo trimestre ""no son buenas"""
anticipacion	Experto explica las razones de la histórica demanda de electricidad durante este invierno
anticipacion	Ecuador se jugará la vida ante Francia por llegar a octavos de final
anticipacion	El Senado aprobó con cambios el nuevo mecanismo de estabilización de precios de los combustibles Mepco
ninguna	Cristián Arnolds es elegido presidente del directorio de Banmédica
confianza	Dólar abre con leve alza tras publicación de positivos datos de empleo en EE.UU.
sorpresa	Pizarro previo a Día del Pisco: 'Regiones pisqueras deben ser tratadas en forma especial'
ninguna	Exportadores chilenos realizan 300 reuniones de negocios en gira que finalizó en el Santiago Bernabéu
ninguna	Programación de la novena fecha de la Fase Nacional de la Primera B
ninguna	Iker Casillas podría convertirse en compañero de Alexis Sánchez en el Arsenal
ninguna	NBA: Ex CEO de Microsoft comprará con cifra récord a Los Ángeles Clippers
anticipacion	"Presidenta Bachelet: ""Queremos que el Gas Natural tenga una mayor participación en matriz energética nacional"""
ninguna	"Discográficas de Lana del Rey habrían ""odiado"" su nuevo álbum de estudio"
tristeza	Robin Williams padecía la enfermedad de Parkinson
confianza	Rusia y Estados Unidos usarán su influencia para acabar los combates en Ucrania
anticipacion	Bachelet busca acelerar proyectos eléctricos en Chile ante creciente demanda
aversion	Pizarro salpicado por SQM le quiebra la cabeza a la DC
tristeza	Anciano muere tras ser atropellado y arrastrado por 120 metros en San Joaquín
anticipacion	Un meteorito cae en Marruecos y atrae a cientos de buscadores de fragmentos
confianza	Decomisan droga valorada en 1,4 millones de dólares en frontera de EE.UU.
miedo	Roban en 50 locales de galería comercial en Santiago Centro
tristeza	Gaza: el inframundo de la globalidad
confianza	Poroshenko dice que se mantiene optimista respecto a acuerdo de alto el fuego
sorpresa	Hombre se declara culpable de reingreso a EEUU
aversion	Programa de la BBC denuncia que su equipo fue agredido en Argentina
ninguna	"Presidente de la UC sigue esperando a Berizzo: ""No hemos recibido un no definitivo de él"""
confianza	SpaceX presenta su prototipo de taxi espacial para la NASA
confianza	Inician limpieza de alcantarillados en Copiapó
anticipacion	Encuentran en Argentina los restos de un saurópodo, el dinosaurio de cuello largo
ninguna	VTR anuncia sus precios para el iPhone 6
sorpresa	¡Impresionante!: se toman la primera selfie sobre el Cristo Redentor
alegria	"Ricky Martin realiza presentación junto a monja semifinalista de la versión italiana de ""The Voice"""
anticipacion	"FMI recomienda a Japón mantener ""agresiva"" expansión monetaria por un tiempo prolongado"
alegria	Ingenieros chilenos fabrican prótesis de brazo con una mano impresa en 3D
confianza	Reforma al binominal: Squella (UDI) llama a Bachelet a 'cumplir con su palabra de escuchar a todos'
confianza	Brasil acoge a más de 5 mil refugiados y pedidos aumentan
anticipacion	Diputados RN piden que ministro de Defensa aclare ataque cibernético a la FACh
aversion	Mi papá me mima: los hijos de políticos que figuran en la lista negra de SQM
anticipacion	Aquí te mostramos el USB del futuro
aversion	"Zolezzi pide ""calma"" por cambios en PSU: ""No se preguntará nada que no se haya pasado en el colegio"""
aversion	Violentos asaltos marcaron las últimas horas en el sector oriente de la capital
ira	Ex capitán de Carabineros condenado por robo con intimidación permanece prófugo
ninguna	El Kun Agüero volvió a entrenar con balón pero sigue siendo duda para cuartos de final
tristeza	Fuentes oficiales elevan la cifra de fallecidos por el sismo en China a 367 personas
confianza	Ernesto Cardenal recibe distinción en Berlín y dona el premio en dinero a proyectos benéficos
ninguna	Josefa en su laberinto
anticipacion	Nuevo análisis revela que PIB de EE.UU. anotó descenso de 2,9% en el primer trimestre
ninguna	Panenka, creador del osado penal: El gol de Messi al Getafe es el mejor de todos
ninguna	Tsipras defiende en Moscú el derecho a una política exterior soberana
ira	Investigación eclesial confirma acusación contra Joannon y dice que mantuvo “relación inapropiada” con madre de bebé dado en adopción
anticipacion	José Mujica visita la Casa Blanca para reunirse con Barack Obama
aversion	Trabajadores de la salud paralizan funciones en rechazo a concesiones de hospitales
tristeza	Los prorrusos derribaron un helicóptero ucraniano y 14 militares murieron
confianza	Escuela de Investigaciones Policiales extiende plazo de postulación para profesionales (cambia dato)
confianza	"Experto colombiano propone ir por ""peces gordos"" del narcotráfico"
ninguna	Transelec anuncia a la SVS la absorción y disolución de su filial en el norte del país
confianza	Godoy dice estar dispuesto a reunirse con intendente por el tema del incendio, pero pone condiciones
ninguna	Volver a Amar mantiene su liderazgo en rating a una semana de su estreno
sorpresa	Johnny Depp da más susto pelado que como el Joven Manos de Tijera
confianza	Arturo Vidal destaca en las primeras imágenes del nuevo PES 2015
confianza	"Israel anuncia una ""tregua humanitaria"" de siete horas en Gaza"
ninguna	"Diputada Hoffman e interpelación a Eyzaguirre: “No sé si otro ministro lo podría haber hecho mejor"""
anticipacion	Eyzaguirre se reúne con tres ex titulares de Educación para discutir alcances de la reforma
tristeza	El suizo Ricardo Rodríguez y su postulación a la Roja: “Me quedé con la ilusión”
miedo	Expertos seguridad de Google alertan de vulnerabilidad de los medios
confianza	"Municipio afirma que mantiene ""abierto el diálogo"" con estudiantes en toma en Instituto Nacional"
confianza	Suprema fija límite para los contratos de jornada parcial de trabajo: 30 horas semanales
tristeza	Irak concentra tropas cerca de ciudad asediada por yihadistas
ninguna	"Gonzalo Fierro: ""Humberto Suazo pudo haber tenido una nueva oportunidad en la selección"""
alegria	Iniciativa de salud internacional hizo disminuir la mortalidad materno-infantil en América Latina
tristeza	Muere la escritora Ana María Matute, una de las más grandes novelistas de España
tristeza	"Dos palestinos muertos por disparos israelíes durante conmemoración de la ""Nakba"""
confianza	Becas Chile ofrece charla en USS de Osorno para estudios de postgrado en el extranjero
confianza	Juzgado de Garantía determina arresto domiciliario total y arraigo nacional para ex gerente de SQM Patricio Contesse
alegria	Acróbata chileno sorprende en programa de talentos de Holanda y avanza a semifinal
anticipacion	"Hillary Clinton sería ""muy eficaz"" como presidenta, opina Obama"
ninguna	El Papa recibirá a San Lorenzo en el Vaticano el miércoles
anticipacion	Irán y las seis potencias ante una nueva fase de las negociaciones nucleares
alegria	Colombia entregará a Chile 15 toneladas de ayuda humanitaria por inundaciones
aversion	Las esquirlas del caso SQM que apuntan al corazón político de los estudiantes de la PUC
anticipacion	Gobierno descarta rediseñar reforma educacional tras bajo respaldo en encuesta CEP
ninguna	Manchester United habría presentado una oferta formal a la Juventus por Arturo Vidal
anticipacion	Admiten proyecto de perforación de Geopark en Tierra del Fuego
sorpresa	Acciones de LATAM Airlines caen tras inesperadas pérdidas en 1er trim
ninguna	FIFA confirma a Shakira en el show de cierre de la Copa del Mundo
ninguna	Aumentan las peticiones de dimisión del secretario de Asuntos de Veteranos
anticipacion	¿Qué implica terminar con la selección? Respuesta a  Vallejo y  Jackson
ninguna	Egidio Arevalo, Jorge Fucile,  Diego Lugano
ninguna	"Cristián Álvarez y su autocrítica en la UC: ""A nosotros no nos sobran copas"""
ninguna	Obra de Andy Warhol vendida en US$ 30 millones lidera nueva subasta de arte contemporáneo
tristeza	Aumentan a 381 los fallecidos por terremoto en el sur de China
anticipacion	Correa presenta en Chile los logros en educación de su Gobierno
anticipacion	"Allamand: ""Encuesta CEP confirma que reforma educacional requiere un cambio completo"""
ninguna	Estos son los artistas que estarán en el Festival Primavera Fauna
anticipacion	China bloquea varios servicios en línea, activistas lo relacionan con Hong Kong
confianza	Suprema pidió a Alemania que médico de Colonia Dignidad cumpla condena por abusos  en ese país
sorpresa	Padrastro de Kim Kardashian alista programa donde mostrará su cambio de género
anticipacion	OCDE revela que profesores chilenos son los que pasan más tiempo en el aula
confianza	UDI y reforma tributaria: Oposición actuó unida para decirle que no a pésimo proyecto
ninguna	Vidal tiene nuevo compañero en Juventus: Morata fue presentado tras superar control médico
confianza	Facebook elimina publicaciones engañosas
sorpresa	"Actualización de ""FireChat"" permite conversaciones entre usuarios Android y iOS, sin internet"
confianza	Santiago Wanderers sumó segunda victoria al vencer a O'Higgins en Copa Chile
ninguna	Diario venezolano El Universal anuncia obtención de divisas para comprar papel
anticipacion	CChC plantea preocupación a Hacienda por eliminación del crédito al IVA de las viviendas
ninguna	Sabella entrega la nómina de Argentina y deja fuera a Banega, Otamendi y Sosa
confianza	Llegan a Adén los primeros barcos con ayuda humanitaria de MSF y Cruz Roja
confianza	"Ministro Arenas asegura que cifras de Imacec permiten contar con un ""moderado optimismo"""
aversion	Velasco refuerza ofensiva contra Arenas y perfila liderazgo crítico de la Nueva Mayoría
ninguna	Gonzalo Lama cortó su racha ganadora y quedó eliminado en el Challenger de Vicenza
ninguna	Djokovic y Federer sufren, pero ya están en octavos de final de Roland Garros
confianza	Cuenta Pública del R. Civil: Más de 2 millones de cédulas fueron emitidas con nuevo sistema
anticipacion	Encuesta CEP: 50% aprueba al Gobierno de Michelle Bachelet y un 29% lo rechaza
anticipacion	Bancada estudiantil apoya petición de la Confech de incidir en proyectos de reforma educacional
sorpresa	"El Gobierno uruguayo se prepara para entregar una ""tablet"" a cada jubilado"
sorpresa	Conoce a Obie, el perro que bajó 23 kilos
aversion	Acusan a la policía India de encubrir el asesinato de dos adolescentes
ninguna	Gerard Depardieu cumplirá su promesa y abrirá un restaurant en Moscú durante octubre
