ninguna	Carrera nocturna en Casablanca obligará a atletas a competir durante 14 horas
tristeza	Chile sucumbe ante el mecanismo naranja
sorpresa	¡Increíble!: diseñan material que vuelve imperceptible al tacto todo lo que cubre
ninguna	Hans Podlipnik tuvo un arrollador paso a los cuartos de final en el Challenger de Meerbusch
tristeza	Familias identifican cuerpos de estudiantes en Kenia
confianza	Canciller de Perú se reunirá con su colega chileno en Asunción
anticipacion	El automóvil de Google que se conduce solo está a la vuelta de la esquina
tristeza	Asesinato a bordo
confianza	EE.UU. y Uruguay firman memorando para impulsar igualdad racial y social
confianza	Ventas minoristas en la UE suben 1,2% en agosto y experimentan mayor alza en nueve meses
ninguna	Acciones de Latam Airlines caen luego de reportar inesperadas pérdidas en 2014
ninguna	UE decidida a imponer a Juncker en la Comisión, a pesar de oposición de Cameron
anticipacion	EE.UU. pide incluir a todas las partes en diálogo nacional en Ucrania
ninguna	"Adame: ""No entiendo cómo no me dieron la oreja"""
tristeza	Un caza F-15 se estrella en Estados Unidos durante misión rutinaria
confianza	Cuba no dará trato preferencial a empresas de EEUU, según ministro Malmierca
ninguna	Corte de Florida falla a favor de Ecuador
anticipacion	Las recomendaciones de la Comisión Etica de la FIFA tras casos de Rusia y Qatar
anticipacion	"Detrás de las fotos: video cuenta cómo Robert Capa obtuvo las fotos del famoso ""Día D"""
confianza	Triángulo terrestre no distraerá integración de Perú y Chile, dice embajador
confianza	Diputada Sabat propone que subsidio de transporte permanente incluya a adultos mayores
tristeza	Dos muertos y cuatro heridos en un ataque a iglesia evangélica en Honduras
ninguna	La compañía emiratí Etihad compra el 49% de Alitalia
anticipacion	Paul Anka cancela dos conciertos en Tel Aviv por conflictos en la zona
confianza	Primera B: Everton inicia con el pie derecho e Iberia se estrena con contudente triunfo
confianza	Obama pide transparencia y paz tras muerte de joven negro en EEUU
ninguna	Unión Española oficializa la partida de Gustavo Canales a Universidad de Chile
ninguna	La Moneda busca Contralor
anticipacion	"Presidente de Uruguay asegura que el Mercosur está ""estancado"""
anticipacion	Sismo sacude frontera entre China y Mianmar
confianza	Gol inicia venta de pasajes entre São Paulo y Santiago de Chile
tristeza	Aumentan a cinco los muertos por tormenta durante regata en EE.UU.
miedo	Con bombazo intentan robar cajero automático en Conchalí
ninguna	"Poniatowska: los reyes que abdican ""son los más queridos por los pueblos"""
confianza	Universidad puertorriqueña y Ciudad de Panamá cierran acuerdo de colaboración
tristeza	Explosión en capital de Nigeria causó 21 muertos y 17 heridos (policía)
tristeza	Siria: 17 muertos en explosión
anticipacion	Reforma Tributaria será debatida y votada en la Cámara de Diputados entre martes y miércoles
anticipacion	Rey Juan Carlos abdica en medio de crisis institucional de la monarquía española
aversion	Penta: Hijo de diputado DC Roberto León aparece entregando una boleta a Soquimich
miedo	Ejército ucraniano destruye dos bases militares de separatistas prorrusos en el este del país
sorpresa	"Joven muere al intentar el ""Ice Bucket Challenge"" en Escocia"
confianza	Incautan 693 kilos de marihuana que estaban enterrados en el desierto
anticipacion	La oposición siria presentará una denuncia contra a Al Asad en La Haya
ninguna	Volkswagen vende récord de unidades influenciado por demanda del Golf
anticipacion	"Humberto Sichel reemplazará a Matías del Río en ""Última Mirada"""
ira	Activistas de la causa indígena queman camión y dejan folletos con amenazas a ex fiscal
ninguna	Presidente de la Comisión Arcis valora renuncia de Juan Andrés Lagos
confianza	Gobierno colombiano dice que los actos terroristas bajaron un 37,2% en cuatro años
tristeza	Tres heridos deja persecución policial por cinco comunas de la capital
confianza	EEUU expresa apoyo a democracia en Venezuela en sus 203 años de independencia
anticipacion	"Rubio pide a Kerry que deje de dar ""señales contradictorias"" sobre Venezuela"
ninguna	"Miley Cyrus y sus exigencias para el ""Bangerz Tour"": Comida orgánica y sin gluten"
aversion	Multan a partido de Rousseff y Lula por irregularidades en cuentas
confianza	La Casa Blanca elogió el desempeño de Estados Unidos en el Mundial
ninguna	Sánchez Cerén desecha prioridad a tregua pandillas
anticipacion	Comienza la cuenta atrás para elecciones que decidirán dirección política UE
anticipacion	Irán envió drones de vigilancia y material militar a Irak (prensa)
confianza	Detienen a líder del cartel colombiano Oficina de Envigado en España
confianza	Junta militar tailandesa libera al primer ministro y otras 32 personas
anticipacion	Congreso niega que haya habido genocidio en Guatemala
ninguna	Los secretos del colombiano James Rodríguez, una de las figuras y revelaciones del Mundial
anticipacion	Walker apunta a mantener corazón de reforma tributaria pero con sugerencias para perfeccionarla
ninguna	Antofagasta Minerals anuncia el término de las operaciones de Minera Michilla en 2015
anticipacion	Crece escándalo de uso ilícito de fármacos por jugadores de fútbol americano
alegria	Carlos Díaz suma un nuevo bronce para Chile en el Iberoamericano de Atletismo
ninguna	Mathías Riquero, el volante que comanda el nuevo proceso de Ñublense
sorpresa	¡Impresionante!: conoce al primer perro-pájaro del mundo
ninguna	Colombia: Partido de izquierda llama a votar por la reelección del Presidente Santos
confianza	Merkel y Putin están de acuerdo en realizar investigación internacional sobre avión malasio
confianza	Ejército israelí anuncia alto el fuego de 7 horas en gran parte de Gaza lunes
tristeza	Al menos 30 muertos deja explosión en centro comercial en Nigeria
anticipacion	Este erizo bebé es lo más lindo del mundo
anticipacion	Peña respalda tesis de Palma y afirma que tal como está la reforma del gobierno debilita la educación pública
ninguna	Carlos Busso asumirá como presidente de la ACTI en reemplazo de Jaime Soto
confianza	Bancadas PS, PC e IC piden comisión investigadora del Pentagate: “Los grandes grupos económicos están acostumbrados a ser los dueños de Chile”
confianza	Representante de Martín Lasarte confirma llegada del DT a la U por una temporada
aversion	Marcha de Profesores: acto cultural termina en medio de incidentes
ninguna	Humala recibe cartas credenciales de nuevos embajadores de Alemania e Italia
ira	Con incidentes menores termina marcha convocada por el Colegio de Profesores
confianza	Carabineros arresta a sujeto que vendía drogas frente a jardín infantil en Peñalolén
ninguna	"Eyzaguirre desestima críticas de la Iglesia: ""Fin del copago no afectará la calidad"""
miedo	"Santiago Pavlovic y equipo de ""Informe especial"" son agredidos en Ucrania por militares"
anticipacion	Queman vivo a un acusado de homicidio y violación en Bolivia
ninguna	España sumaría su primera baja para el Mundial: Thiago Alcántara está en duda por lesión
anticipacion	El rol clave de Montes en la reforma educacional y su comentada distancia de Eyzaguirre
anticipacion	Sugardaddy.fr, ¿sitio de contactos o prostitución online?
confianza	Arenas llama a cuidar las expectativas en el contexto de alianza público-privada
aversion	Maestras son arrestadas por hacer un trío con alumno
confianza	Awad dice que hay consenso en necesidad de una reforma tributaria, pero pidió aclarar aspectos que “adolecen de inconstitucionalidad”
ninguna	Estudiantes convocan a marcha para solidarizar con palestinos y piden cortar relación con Israel
ira	Sernac: Diferencias de más de $22 mil de pasajes de buses por fin de semana largo
aversion	Vicepresidente argentino suma una nueva denuncia por presunta corrupción
aversion	John O’Reilly: cuatro años sin cárcel por abusar de una menor
confianza	El príncipe Enrique de Inglaterra visita comunidad de realojados en Brasil
anticipacion	Bolsas europeas cierran en equilibrio por posible impulso del BCE a la economía de la zona
ninguna	"El nuevo líder socialista español descarta una ""gran coalición"" con el PP"
ninguna	PSA Peugeot-Citroén construirán su cuarta fábrica en China con socio Dongfeng
miedo	Canadá desplegará aviones de combate en Irak (prensa)
ira	Dávalos defiende reunión con Luksic y dice que no fue “imprudente” porque trabajaba en el mundo privado
confianza	Esposa de Robin Williams revela que el actor padecía Parkinson y confirma sobriedad
anticipacion	Irán y el grupo de seis potencias reanudaron hoy sus negociaciones nucleares
anticipacion	Onemi declara Alerta Temprana Preventiva para Región Metropolitana por posibles lluvias
tristeza	Muere ex miembro de la popular banda Miami Sound Machine
confianza	La ciudad polaca de Wroclaw será la Capital Mundial del Libro en 2016
alegria	Sánchez anota su primer gol en Arsenal y le da la clasificación a la fase grupal de la Champions
anticipacion	Los puntos de la reforma tributaria que generan discrepancias al interior de la Nueva Mayoría
confianza	HRW critica a Indonesia por ejecutar a un reo brasileño con esquizofrenia
tristeza	El crudo relato de periodista de The Guardian que presenció ataque a niños que jugaban en playa de Gaza
confianza	Castro exculpa a Obama de la responsabilidad política de su país hacia Cuba
ninguna	Infografía: Las medidas para evitar congestión este fin de semana en los accesos a Santiago
confianza	Jamaica aumenta la seguridad aérea ante la visita del presidente de EE.UU.
sorpresa	Británico Cameron dice que no dimitirá si Escocia vota a favor de la independencia
aversion	Diputados DC en picada contra Arenas por “falta de prudencia política, lo que es grave en un ministro”
ira	Choferes de buses Coronel-Lota mantienen paro y causan problema en usuarios
confianza	Copa América: Alcalde de Concepción pedirá que Chile juegue en el Ester Roa y no sólo en Santiago
ninguna	Encuesta Adimark: Aprobación y rechazo a Bachelet se mantiene estable
ira	"Corea del Norte justifica insultos racistas a Obama: Lo calificaron de ""malvado mono negro"""
tristeza	El incendio que afecto al suroeste de Jerusalén está bajo control
confianza	"Ex Presidente Lagos defiende reforma tributaria y dice que es ""indispensable"" para el país"
confianza	Obama dijo que el museo del 11S mantendrá viva la memoria de las víctimas de las Torres Gemelas
tristeza	Muere tiroteado en Londres un imán crítico con el régimen sirio
anticipacion	Moreira solicita a Cámara de Diputados acceso a su ex cuenta de correo electrónico en medio del caso “Pentagate”
confianza	Diputados UDI valoran 'apertura al diálogo' en proyecto de administrador provisional
confianza	Francisco llama a madre de joven argentina desaparecida
ninguna	La resurrección de Boeninger y la agenda de los “moderados”
aversion	Las isapres no pierden: logran cifra histórica de utilidades y atribuyen ganancias a “año benigno”
confianza	Toselli fue operado con éxito y necesitará al menos 2 meses de recuperación
aversion	Tribunal Supremo turco dictamina prohibición a YouTube viola derechos: medios
tristeza	Mueren 83 insurgentes en Afganistán en ofensivas y por bombardeo de un dron
ninguna	Argentina cree que el partido con Bosnia será clave
ninguna	La reforma educacional es lo que es… reforma
confianza	Oposición rechaza supuesto plan magnicida que ya marca la agenda venezolana
confianza	Los ciudadanos de la UE podrán presentar demandas sobre privacidad en EEUU
anticipacion	Ciclismo: El italiano Diego Ulissi dio positivo por salbutamol en el Giro de Italia
anticipacion	Cómo prevenir el ataque de las peligrosas medusas irukandji
anticipacion	Reservas de petróleo en Estados Unidos registran una sorpresiva alza
ira	"Sudán: Pena de muerte a mujer por ""apostasía"""
ira	Delincuentes ingresan a robar a 50 tiendas de una galería en Santiago
tristeza	Al menos seis muertos en dos atentados suicidas en Bagdad
confianza	Bachelet y los parlamentarios de la Nueva Mayoría analizarán las reformas del Gobierno esta noche
confianza	Partidos chilenos en Foro de Sao Paulo: no se avanza con Bolivia recusando el diálogo
confianza	Suprema avala derecho a manifestación de Andha Chile en seminario y aclara su rol ante demandas
confianza	Empleados de Superintendencia de Educación anuncian continuar paro y reciben respaldo de la Anef
anticipacion	BBC: Cómo funciona la mente de un violador
ninguna	Susan Boyle se prepara para su primera gira por Estados Unidos
anticipacion	Cuba rechaza multa récord de EEUU a banco francés
anticipacion	Agencia de comercio ONU dice fallos sobre deuda Argentina erosionan inmunidad soberana
tristeza	Fuertes lluvias dejan un muerto y más de 200.000 desplazados en Paraguay
ninguna	"Benicio del Toro asegura que película sobre Pablo Escobar muestra su faceta de ""villano y héroe"""
ninguna	Y al final ¿quiénes son los que provocan desconfianza?
tristeza	Mueren 6 milicianos chiíes en un atentado al norte de Bagdad
anticipacion	Ucrania se niega a pagar por adelantado el suministro del gas ruso de junio
confianza	Estiman que un 60% de afiliados con preexistencias podrán cambiarse de Isapre
tristeza	Cambio climático puede poner en peligro de extinción a una de cada seis especies
ninguna	El otoño de la masonería
sorpresa	Apple Watch no funcionaría bien en las muñecas tatuadas
anticipacion	Sony anuncia Xperia ZL2, su nuevo smartphone
confianza	La Casa del Rey de España respeta la imputación de la infanta Cristina
ninguna	Cristina Fernández destaca acuerdo con Club de París sin intervención del FMI
sorpresa	Estudio vincula el consumo de Omega 3 con la capacidad para dejar de fumar
anticipacion	PDI detuvo a sujeto que confesó haber violado a niña de 12 años
tristeza	Ex 'dealer' de Angelina Jolie difunde imágenes de la actriz consumiendo drogas
tristeza	Enfrentamientos en Estambul durante una protesta por la tragedia minera
confianza	Inauguran en la ULS exposición sobre hallazgos arqueológicos más importantes en Alemania
confianza	Alumnos de liceos emblemáticos anuncian nueva marcha para este miércoles en protesta contra cuestionado ranking de notas
ninguna	Solís dice que acatará fallo sobre presencia de obispo luterano en gabinete
alegria	Bencinas bajarían $1 a contar del próximo 9 de octubre
sorpresa	Presidente de Paraguay insultado mientras presidía actos por el Día de la Independencia
confianza	PDI detiene a boliviano que portaba 63 ovoides con pasta base en su abdomen
sorpresa	Entró a robar a una casa y lo detuvieron porque dejó su cuenta de Facebook abierta
confianza	Argentina vence a Nigeria con otra gran actuación de Lionel Messi
tristeza	Antigua musa de las pasarelas españolas muere cuatro días antes de contraer matrimonio
anticipacion	Hoy Hernán Larraín será ratificado como presidente de la UDI
confianza	Microsoft prepara un reloj compatible con iOS y Android
ninguna	Arredondo se une al festival colombiano en el Giro de Italia y Quintana sigue líder
confianza	La Moneda saca cuentas alegres tras  irrupción del movimiento estudiantil en el escenario político
ninguna	Rihanna estrena en vivo su nuevo hit American Oxygen
anticipacion	Prueban en seres humanos vacuna contra el virus de la fiebre Chikungunya
anticipacion	Nicaragua autoriza a navíos extranjeros operar en zona adjudicada tras fallo de La Haya
ninguna	Programación del miércoles 25 de junio: Se definen los grupos E y F
confianza	Argentina condena nuevo ataque contra escuela de la ONU en Gaza
confianza	Bachelet da señal política y apunta a incorporar a pueblo indígena al Parlamento tras dichos de Huenchumilla
sorpresa	EEUU acusó erróneamente a cantante dominicano
tristeza	Al menos 21 muertos y 17 heridos deja explosión en centro comercial de Nigeria
tristeza	Al menos 17 muertos por una explosión cerca de frontera entre Siria y Turquía
tristeza	Temporal en el sur: Río se desborda y deja 200 damnificados
tristeza	Al menos 2 muertos y 19 heridos tras la caída de viaducto en Belo Horizonte
aversion	Denuncian a turistas por grabar sus nombres en los pilares del Coliseo
ninguna	Condenan a Turquía a pagar millonaria multa por desaparición de grecochipriotas en 1974
confianza	Presidente de Comisión de Economía adelanta cambios al proyecto que fortalece al Sernac
ninguna	Demi Lovato alista los detalles de su nueva gira mundial
sorpresa	¡De terror! Viento eleva inflable con niños en su interior
ninguna	Alemania descarta cerrar TLC entre Estados Unidos y Unión Europea a fines de 2015
confianza	Subsecretario de Transportes e intendente visitan obras de Mapocho 42k en Quinta Normal
ira	Alcalde de Buin admite no poder pagar sueldos de profesores y pide acelerar desmunicipalización
ninguna	Cataluña mantiene convocatoria a referéndum pese a suspensión por la justicia
ninguna	Cartica dice que divulgaciones de CorpBanca revelan desprecio de Saieh por regulaciones de Wall Street
confianza	El video que te hará sonreír hoy: sorprenden a trabajadores de comida rápida con propinas de 55 mil pesos
ninguna	Obama dice que EEUU rompió asedio de EI en Monte Sinjar, en Irak
sorpresa	Camboyano adoran a pitón de la suerte para ganar la Lotería
confianza	Bancada estudiantil coincide con la Confech en que los actores sociales deben incidir en los proyectos de la reforma
confianza	"Primer Ministro chino: Tenemos ""mucho por recorrer"" para ser la primera economía mundial"
confianza	Doce años de prisión para 6 policías por intento de asesinato de Rafael Correa en 2010
aversion	Policía reprime protestas contra el gobierno turco tras accidente minero
anticipacion	Canciller asistirá en Perú a declaratoria del Camino del Inca como Patrimonio de la Humanidad
confianza	Gobierno anuncia querella contra autores de atentados en La Araucanía
miedo	Una mujer muere a manos de la policía en San José (EE.UU.)
anticipacion	Mira el regalo de cumpleaños que hizo feliz a este perro
aversion	FIFA sanciona con multa a Chile y pone en la mira a la marea roja para el partido con Brasil
anticipacion	Nicolás Jarry avanzó sin problemas a los octavos de final del Futuro 3 de Serbia
tristeza	Un muerto y 10 heridos al derrumbarse viaducto en ciudad mundialista de Belo Horizonte
confianza	"Peña Nieto apoya el diálogo de ""dos grandes amigos"", Estados Unidos y Cuba"
confianza	Metro: restablecen el servicio en todas las estaciones de Línea 1
anticipacion	"Peñailillo dice que busca una solución de ""Estado"" y no inmediatista en La Araucanía"
confianza	El Gobierno pidió que haya flexibilidad para que los trabajadores puedan ver el Mundial
anticipacion	Sismo de menor intensidad fue percibido en las regiones de Los Lagos y Los Ríos
confianza	Rincón llama a ser partícipes de mejora constante del régimen democrático
anticipacion	"En Río de Janeiro estrenaron ""Messi"", la película dirigida por Álex de la Iglesia y escrita por Valdano"
ninguna	"Marilyn Manson tendrá un papel estable en la serie ""Sons of Anarchy"""
confianza	"Director y actriz de la película ""Las Analfabetas"" realizarán conversatorio con la audiencia"
aversion	Empleados de la salud iniciaron paro de 48 horas
anticipacion	"Amplitud por Reforma Tributaria: ""Perdieron los chilenos"""
anticipacion	¡Increíble!: 68 celebridades que son igualitas a otra celebridad
confianza	Cancillería se cuadra con EE.UU. y defiende el Visa Waiver: “No afecta la privacidad de los chilenos”
anticipacion	"Eyzaguirre: ""La reforma se hace de abajo para arriba, conociendo la realidad de las salas de clases"""
ninguna	Rugby: Última fecha del Torneo Nacional ADO definirá todo en el Grupo A
aversion	Marcha Colegio de Profesores: acto cultural termina en medio de incidentes
confianza	Ministra de Cultura llama a salir de la lógica del consumo en el Mes de los Niños
anticipacion	Dólar abre a la baja en medio de un panorama de pesimismo y aversión al riesgo en el mundo
aversion	La boleta de Lily Pérez a cuestionada sociedad de RN que recibía financiamiento de SQM
ninguna	"Chilenos prefieren ""vitrinear por internet"" que comprar directamente en línea"
sorpresa	"Barack Obama: ""Rusia es un país que no produce nada"""
confianza	Diputados Girardi y González (PPD) destacan aprobación de proyecto sobre administrador provisional
confianza	EEUU: Líder de tea party apoya reforma migratoria
ninguna	Air Europa y Aerolíneas Argentinas operarán en código compartido desde julio
anticipacion	EEUU despliega marines hacia Italia ante amenaza en Libia (oficial)
sorpresa	"""CBS golpea a los seguidores de """"Two and a Half Men"""" anunciando el final de la serie"""
confianza	Ministros y empresarios argentinos viajarán a Rusia para promover exportaciones de alimentos
confianza	Fuerzas Aéreas de América firman memorando de cooperación en desastres
anticipacion	Oliver Stone llevará a la pantalla grande la vida de Edward Snowden
confianza	Con incidentes aislados termina marcha convocada por Colegio de Profesores
anticipacion	Senadores rechazan informe de la Cámara que aprueba exclusividad universitaria sólo para dos carreras del área de salud
ninguna	Argentino Pablo Guede fue oficializado como nuevo entrenador de Palestino
tristeza	Onemi cifró en 8.426 las personas aisladas en La Araucanía por sistema frontal
anticipacion	"Apoderados discrepan de ministro: ""Muchos colegios pasarán a ser particulares pagados"""
tristeza	Ejército colombiano acusa a las Farc de reclutar a siete menores de edad
anticipacion	Alumnos de colegios escuchan a prestigiosos científicos acerca de cómo evolucionan los seres vivos
anticipacion	EEUU: Economía decrece 2,9% en 1er trimestre
aversion	Los nombres tras las 846 boletas y facturas falsas que denunció el SII
ninguna	El “Negro” Piñera no irá en moto a Brasil para el Mundial: realizará viaje familiar a Europa
confianza	Nadal avanzó en Roland Garros y ahora jugará con el argentino Mayer
confianza	Ex mirista condenado por secuestro de Olivetto llega hoy al país tras acuerdo con Brasil
sorpresa	U. de Concepción ocupó 6 extranjeros al mismo tiempo en Copa Chile y perderá los puntos
confianza	"Peñailillo: ""Valoramos el tremendo trabajo de Caszely en España"" pese a salida de su cargo"
ninguna	"Ex presidente de Comunidad Judía en Chile: ""Un ataque a un recinto que no es parte del conflicto es repudiable"""
ira	SII se querella por delito tributario contra el “choclo Délano”, financista de la UDI, y su socio Carlos Eugenio Lavín
ninguna	La nueva generación del tenis que irrumpe en el pasto de Wimbledon
anticipacion	Municipios de la Región Metropolitana firman convenio para avanzar en transparencia
anticipacion	Chile tiene una nueva arma a la cual aferrarse ante Brasil: La maldición de Mick Jagger
confianza	Subsecretario del Trabajo y baja en el desempleo: Tenemos que preocuparnos de la calidad
confianza	Presidenta Bachelet da a conocer los siete ejes de la agenda energética 2014-2018
confianza	El centro de actividad de los ciclones de desplaza del trópico a los polos
anticipacion	Simeone no descarta irse del Atlético y en España ya lo ven como reemplazante de Pellegrini
ninguna	Frank Lampard anuncia su adiós del Chelsea al que defendió por 13 temporadas
aversion	Confirman 20 detenidos en campamentos de protesta contra Gobierno venezolano
ninguna	ANFP comunica pérdida de sólo 3 puntos para Cobreloa y se ratifica su descenso a la B
anticipacion	Dale la bienvenida a la nueva era de internet con HTTP/2
ninguna	Minera Escondida adjudica contrato de suministro de GNL para nueva central generadora Kelar
aversion	Caso Caval: Sólo diputados DC votaron en contra de la comisión investigadora
confianza	La segunda edición del premio García Márquez buscará mantener vivo su legado
confianza	Jordania toma precauciones para controlar la frontera con Irak
anticipacion	Paro de Transantiago: Dirigentes descartan fracaso y aducen baja adhesión por amenazas
tristeza	Un militar de la OTAN y un soldado afgano mueren en un enfrentamiento
anticipacion	Fiscalía pide tramitar extradición de expresidente salvadoreño desde Panamá
confianza	Brasil acoge a 5.208 refugiados de 80 nacionalidades y los pedidos aumentan
anticipacion	"F-1: Mercedes dice estar en alerta tras el ""llamado de atención"" que dio Ferrari en Malasia"
anticipacion	"Ministro Arenas ante comisión del Senado: La ""Reforma Tributaria debe ser perfeccionada"""
sorpresa	Fondo de Warren Buffett comprará Duracell a Procter & Gamble en US$4.700 millones
ninguna	La gran duda en Brasil es quién va a una segunda vuelta frente a Rousseff
confianza	El TPIY confirma la cadena perpetua por genocidio contra ex general Tolimir
confianza	Actor británico Gary Oldman pide disculpas por comentarios antisemitas
confianza	Corte de Concepción acoge recursos y ordena medidas para la operación del Complejo Central Bocamina
aversion	Bloque del 2011 lanza ofensiva política  para  evitar “cumbre de las galletas” en Educación
aversion	Movilh denuncia 'abuso policial' homofóbico cometido en La Calera
ninguna	Palmeiras dejará partir a Jorge Valdivia si aparece una buena oferta por él
ninguna	Falabella baja 0,4% sus ganancias respecto al mismo periodo de 2013
aversion	El candidato Piñera y las irregularidades en la Secom bajo su mandato
tristeza	Brutal ataque: jauría de perros salvajes mata a 27 ñandúes en zoológico de Mendoza
ninguna	GDF Suez subraya necesidad de avanzar en interconexión entre el SIC y el SING
ira	Las prácticas antisindicales tras el drama del micrero que se prendió fuego “a lo bonzo”
confianza	Lea Michele recuerda a Cory Monteith en el día del cumpleaños del fallecido actor
ninguna	“Si se falla en contra de los productores de pollos se está dando una señal clara de que las reglas del juego cambiaron”
