tristeza	Al menos 17 muertos en atentado con coche bomba cerca de la frontera sirio-turca
confianza	Reforma tributaria: Amplitud lanza video pidiendo seriedad al gobierno
ninguna	Amnistía Internacional pide perdón a Iggy Pop por usar su imagen en campaña contra la tortura
anticipacion	Tribunal rechaza sobreseimiento de Ezzati en causa por obstrucción a la investigación
miedo	Se extienden violentos disturbios contra China en Vietnam
tristeza	Más de 330 palestinos muertos en Gaza, Ban Ki-moon viaja a la región
tristeza	Asesinato de tres estudiantes israelíes amenaza con nueva escalada de violencia en Medio Oriente
ninguna	Betty Boop regresará al cine de la mano de Simon Cowell
sorpresa	Felipe VI de España afronta su primera prueba con procesamiento de su hermana Cristina
aversion	Inicia en Perú juicio por irregularidades en adjudicación de lotes petroleros
ira	Incautan más de 91 mil camisetas de la selección chilena falsificadas en Estación Central
confianza	Alemán John Degenkolb repite victoria en la Vuelta a España y Matthews sigue líder
confianza	Canciller participará en Perú en declaratoria del Camino del Inca como Patrimonio de la Humanidad
confianza	La aplicación Facebook Messenger llega finalmente a los equipos iPad
confianza	IBM espera que negocio de hardware se estabilice este año
anticipacion	Aleuy anuncia mesa de trabajo entre aparato público y privados por robos en transporte de valores
confianza	Grupo abogará en México por niños que dejan EEUU por deportación de padres
confianza	Alumnos de la UNAB entregarán carta a Laureate pidiendo “devolver autonomía” a la casa de estudios
confianza	Miguel Crispi: “El movimiento social debe ser más cercano a un carnaval, no que la noticia sea la molotov”
confianza	Bachelet  presenta Agenda de Energía enfocada en reducir precios de la electricidad
anticipacion	Cobre cierra a la baja en jornada marcada por negativos resultados en mercados externos
anticipacion	Rector Zolezzi niega que U. de Santiago entregue datos de alumnos a entidad bancaria
tristeza	Profesora pide dinero en la calle para sobrevivir después de 35 años de trabajo
anticipacion	El documento de la fiscalía que relata cómo llegaron al primer sospechoso del robo al aeropuerto
sorpresa	"Avión malasio perdido: Director de aerolínea afirma que podrían tardarse ""décadas"" en hallarlo"
ninguna	Mira los uniformes que usarían los personajes de Game of Thrones para jugar fútbol
aversion	Mundial al día: Hincha argentino es herido de bala previo al duelo ante Nigeria
confianza	Cristiano Ronaldo se ilusiona con la Champions y dice que él es parte de la historia del Madrid
alegria	Experto asegura que el cáncer se podrá controlar más fácilmente en menos de 50 años
sorpresa	Neurólogos investigan si la corrupción podría ser un problema mental curable
anticipacion	¡Estas son las fechas en que volverán tus series favoritas!
anticipacion	Mineduc designa a José Miguel Serrano como nuevo director nacional (pt) de Junaeb
ninguna	Qué pasó con aquellas queridas estrellas juveniles de los años noventa
tristeza	Escolar muere en confusa balacera en colegio de Linares
sorpresa	Hallan fósiles de animales que vivían en Bolivia durante la Edad de Hielo
anticipacion	Primer ministro chino advierte que economía enfrenta creciente presión a la baja
confianza	Detienen a un supuesto guerrillero de las FARC en el norte de Ecuador
tristeza	Unos 2.000 civiles muertos por bombardeos aéreos del ejército sirio en Alepo en cinco meses
alegria	"Cate Blanchett habla de su nueva hija: ""Ha sido un absoluto regalo"""
confianza	PDI de La Calera arresta a siete personas con 363 ovoides de cocaína
confianza	"Peñailillo por declaración de Nueva Mayoría y Alianza: ""Como gobierno lo valoramos mucho"""
ninguna	Paul McCartney reprograma conciertos suspendidos por problemas de salud
ninguna	Mepco es remitido a Bachelet para su promulgación
tristeza	Al menos diez muertos en el naufragio de un barco de inmigrantes entre Italia y Libia
anticipacion	"Cencosud dice que despidos buscaban ""mayor eficiencia"" y no hay más recortes programados"
confianza	Película protagonizada por Tomás Verdejo se estrenará gratis por Internet
ninguna	Falcao no va al Mundial: Pekerman entregó nómina de los 23 de Colombia sin el atacante
ninguna	El Supremo abre causa contra Chaves y Griñán por los ERE
ninguna	Ocupación de alojamientos durante las vacaciones de invierno fue de 54% en el país
confianza	Lanzan campaña para prevenir ataques a automovilistas en sector de El Salto en Recoleta
aversion	Banmédica entra al rodeo: pierde a su gerente general por recibir bonos de forma irregular
tristeza	Al menos 11 muertos y 45 heridos en atentados con coche bomba en Bagdad
anticipacion	Escalona: Un acuerdo político conlleva la sospecha de eludir la acción de los tribunales
alegria	A diferencia de los últimos dos mundiales, Chile llega a octavos sin jugadores suspendidos
anticipacion	Los números de la conferencia de Sampaoli
tristeza	Corales vivos en el Caribe se han reducido a la mitad en los último 50 años
tristeza	Turcos protestan por explosión en mina que ha dejado al menos 245 víctimas fatales
confianza	Cobre acumuló aumento de 4% en mayo impulsado por mejora en demanda china
sorpresa	Bebé inmigrante llega sola a España a bordo de una embarcación
sorpresa	Latinoamérica presenta la tasa más alta del mundo de mujeres en investigación
anticipacion	Yo me muero como viví
confianza	Alemania donará 220 millones de dólares a luchar contra el ébola en África
tristeza	Fuerte sismo en el suroeste de China deja al menos 367 muertos
ninguna	Nairo Quintana gana una etapa excepcional y le pone su firma al Giro de Italia
confianza	En la UC destacan que Toselli está capacitado para partir al extranjero
anticipacion	El choque frontal entre la ex Concertación y la Nueva Mayoría que se avecina para La Moneda
tristeza	Conchalí: Joven mata a balazos a hermano de su padrastro
ninguna	Giro de Italia: Ulisi gana en primer contacto con la montaña,  Matthews sigue de líder
ninguna	Shakira homenajea a vocalista de  Fleetwood Mac en los premios BMI Pop
alegria	Gol a gol de las revanchas de la fase previa de la Champions: Anotó Sánchez
ninguna	Primera licencia de manejar de Frank Sinatra sale a subasta en Boston
tristeza	Organizan protestas en EEUU tras asesinato de hombre negro a manos de policía blanco
alegria	Sánchez es el tercer goleador de Europa en la temporada y lo eligen en 11 ideal de la Premier
miedo	Bomba en vagón del Metro fue activada 15 minutos antes de estallar
ninguna	Juan Manuel Santos abrirá la primera sesión plenaria de la VII Cumbre de las Américas
ninguna	El rector, el aborto y sus trabajadores
anticipacion	Presentan un gel médico capaz de regenerar tejido óseo en cualquier parte del cuerpo
tristeza	Equipo forense pone en duda que los restos encontrados en México sean de los estudiantes desaparecidos
ninguna	ABIF dice que 300 mil personas podrían salir del sistema bancario por rebaja de TMC
confianza	OS-7 de Carabineros desbarata banda de traficantes de drogas en Sexta Región
anticipacion	El Ejército tailandés dice que quiere defender la democracia de la corrupción
ninguna	La Poderosa Musa: así bautizaron a Fran Undurraga en España por su cuerpo pintado
confianza	Prisión para principal imputada por apropiación indebida de más de $11 mil millones
sorpresa	Presidente de la Corte Suprema de Chile renuncia a coordinar causas de DDHH
sorpresa	Tommy Robredo dio la gran sorpresa en Cincinatti y eliminó a Djokovic
anticipacion	Elizalde y participación política indígena: Decisiones se adoptarán una vez que concluyan las consultas
ninguna	"El Pentágono dice que siguen en el monte Sinyar ""cuatro o cinco mil"" personas"
sorpresa	Mujeres se manifiestan en ropa interior frente a La Moneda
anticipacion	Dólar cierra con retroceso por alza en el precio del cobre y ubica por debajo de los $550
confianza	Gary Medel se acerca a Italia: el Inter de Milán estaría interesado en ficharlo
anticipacion	Maléfica se suma a lista de las películas más exitosas del año
confianza	Justicia desafora a diputado de RN Rosauro Martínez por crimen de miristas cuando estaba al frente de comando militar en Valdivia
confianza	Portugal ayudará a Banco Espírito Santo con dinero de rescate financiero
sorpresa	Nintendo se disculpa por no incluir relaciones gay en juego
sorpresa	Mujer en Estados Unidos podrá pedir el divorcio a través de Facebook
sorpresa	El avión malasio con 239 personas no cayó en la zona de búsqueda
confianza	Facebook elimina fotos de sexy cazadora tras indignación
ninguna	Rihanna vuelve a sorprender con atrevido atuendo en encuentro de moda en EE.UU.
confianza	Sampaoli no da descanso a la ‘Roja’ y comienza los trabajos con miras al duelo ante Brasil
confianza	Rousseff presenta trofeo de la Copa del Mundo y garantiza la seguridad en el Mundial
ninguna	Resultados y programación de los cuartos de final de la Copa Chile
miedo	Israel despliega en Gaza a casi todo su ejército regular de combate
confianza	Policía peruana impide a la marcha patriótica llegar a la frontera con Chile
ninguna	Copa Latinoamérica de LOL anuncia torneo de Apertura 2015
ninguna	Arsene Wenger renueva por otras tres temporadas como técnico del Arsenal
ninguna	Catherine Zeta-Jones protagonizará película sobre mujer líder del narcotráfico latinoamericano
anticipacion	"Monseñor Alejandro Goic por reformas: ""Me preocupa este frenesí legislativo"""
anticipacion	"12 datos curiosos sobre el rodaje de ""Los vengadores: La era de Ultrón"""
ninguna	Evo Morales mantiene amplia ventaja a menos de una semana de elecciones en Bolivia
anticipacion	Impacto del conflicto iraquí en Chile: estiman que alza del petróleo podría retrasar recorte de tasas del BC
aversion	El flamante negocio de los sostenedores de colegios con las ATE y la Subvención Escolar Preferencial
confianza	UE inicia en Nicaragua aplicación de nuevo sistema de información de visados
tristeza	Nueve muertos y más de 40 heridos en un accidente de autobuses en Alemania
ninguna	Murray aplasta a Rola y sigue firme en la defensa de su título en Wimbledon
ninguna	Hijo de Fidel Castro visita museo donde reposan restos de Chávez en Caracas
sorpresa	Selección chilena cae ante la Sub 21 en partido de entrenamiento
confianza	Vaticano instalará duchas para mendigos en plaza de San Pedro
anticipacion	"Google presenta un rediseño de su plataforma para móviles con el nuevo ""Android L"""
anticipacion	Presidenta valora avance de reforma educacional en la Cámara y pone en marcha el PACE en Pudahuel
confianza	Blanco: ojalá que trabajadores y empleadores puedan gritar juntos goles de Chile en el Mundial
ninguna	César Barros celebra y La Polar queda lista para la venta tras acuerdo con acreedores
tristeza	Este viernes repatriarán restos de estudiante asesinada en Buenos Aires
anticipacion	Acuerdo nuclear con Irán: amplían plazo para negociaciones hasta el 24 de noviembre
tristeza	Cinco heridos por una granada en una maniobra militar en Portugal
confianza	Media Luna Roja palestina condena el ataque a hospitales en Yarmuk
sorpresa	Cinco metidas de pata catastróficas cometidas por principiantes
confianza	Lagos Weber (PPD) asegura que en el Senado “hay espacio” para que la Reforma Tributaria “pueda tener modificaciones para bien”
aversion	Fiscal de Rancagua cita a declarar a los siete gendarmes suspendidos por agresión a reos
ninguna	Gary Oldman recibe avalancha de críticas tras defender comentarios antisemitas de Mel Gibson
ninguna	Los Verdes, los únicos que presentan una candidatura compartida a la CE
sorpresa	Director de Iron Man 3 realizará nueva cinta de Depredador
anticipacion	Beneficios de minera estatal chilena Codelco caen 38 pct en 1er trim por menos ventas
confianza	Sin calidad no hay inclusión: una ruta alternativa para Atria
aversion	El ex director del SII que hace lobby contra la reforma tributaria y defiende intereses de la CPC y los bancos
confianza	Alemania reforzará la seguridad en algunas embajadas por temor a ataques
ninguna	José Contreras es el primer refuerzo de Audax Italiano para el Apertura 2014-2015
confianza	"Autoridades y ""Furiosos Ciclistas"" definieron el recorrido de la cicletada de este martes"
confianza	Los cancilleres de Perú y Chile se reunirán hoy en Lima
sorpresa	Forenses encuentran evidencias de fosas con restos humanos en selva de Perú
ninguna	Nuevo timonel de RN toma distancia de estrategia de la “trinchera” y el “panfleto” de la UDI
ira	Miley Cyrus traspasa sus límites: show de alto contenido sexual en Londres
anticipacion	Senadora Muñoz (PPD) plantea necesidad de establecer un royalty a la industria pesquera
alegria	Mundial al día: Toselli felicita a Bravo por su traspaso al Barcelona
anticipacion	Las claves para entender el virus de Chikungunya
ninguna	Telecom Italia confirma interés en brasileña GVT pero aún no presenta oferta
anticipacion	La Moneda y la Nueva Mayoría refuerzan a Eyzaguirre para segundo aire de la Reforma Educacional
anticipacion	La definición por la Rectoría de la Universidad de Chile: el mapa para la segunda vuelta
anticipacion	La historia oculta de Carlos Peña: su encontrón con Piñera, su rol  en la caída de Cuadra y sus asesorías jurídicas a grandes empresas
confianza	Chile destacó el rol del rey de España en la transición a la democracia
anticipacion	Camión vuelca en Autopista del Sol y corta tránsito
aversion	"El técnico de Brasil se declaró seguidor de Pinochet: ""Hizo muchas cosas buenas"""
anticipacion	Plan Z: el ‘mito fundacional’ de la dictadura en detalle
confianza	SIP condena intimidación judicial y física contra los periodistas brasileños
ninguna	Las siete señales del cambio de paradigma en Chile: respuesta a Marcel Oppliger
anticipacion	Eurostat: Ventas minoristas de la zona euro se estancan durante mayo
anticipacion	Bolsa de Santiago cierra a la baja y acumula un alza de 3,2% en abril
confianza	Essbio de O'Higgins lanza plan de mantención de alcantarillados y llama a no usarlos como basureros
aversion	Gobierno responsabiliza a Azul Azul por bengalas encendidas ante Emelec
confianza	La próxima evolución de Chrome OS incluirá aplicaciones de Android
anticipacion	Índice de satisfacción de clientes bancarios en Chile anota leve caída en el primer trimestre
tristeza	Graves y sin posibilidad de ser separadas se encuentran siamesas nacidas en Bolivia
ninguna	Barnes & Noble comienza su proceso de separación de su librería virtual Nook
confianza	Reino Unido defiende prorrogar sanciones a Rusia si no respeta alto el fuego
anticipacion	Actores del sector minero y energético analizan propuesta de reemplazar al Comité de Ministros
ninguna	Las auditoras privadas, el Senado y el director de Impuestos Internos
ninguna	El Papa Francisco nombró como nuevo obispo auxiliar en Mendoza a ex misionero en Cuba
confianza	UE lanza campaña contra evasión fiscal corporativa
anticipacion	El departamento de Estado sale a defender intereses norteamericanos en Chile y manda señal a La Moneda sobre reformas
ninguna	¿Es malo usar el sex-appeal para lograr lo que desea?
aversion	EEUU: Acusan a de discriminación a 4 aseguradoras
confianza	"Diputados UDI valoran ""apertura al diálogo"" en debate de proyecto que crea interventor para las Ues"
tristeza	Al menos 21 muertos y 17 heridos en explosión en un centro comercial de Abuya
miedo	FARC: Quien rompa proceso de paz en Colombia pagará un costo político enorme
confianza	Bachelet presenta hoy la Agenda de Energía para impulsar el desarrollo del sector
tristeza	Seis miembros de una misma familia mueren en incendio en ciudad de Venezuela
ninguna	El pianista Michio Nishihara Toro ofrecerá serie de dos conciertos en Providencia
confianza	"Presidente de Cobreloa: ""Siempre hemos actuado de buena fe"""
ninguna	"Superintendente de Salud: Es ""insuficiente"" propuesta de Isapres por preexistencias"
anticipacion	Japón y China buscan reunión bilateral en cumbre APEC de noviembre: reporte
confianza	Consejo Consultivo de Adolescentes busca prevenir suicidio y embarazo
ninguna	Resultados y programación de la fecha 18 del Torneo de la Primera B
ninguna	Real Madrid oficializa la contratación del portero costarricense Keylor Navas
alegria	Importante aumento de la esperanza de vida registran los países pobres
ninguna	Gol a gol de la final de la Europa League: Juegan Sevilla y Benfica
confianza	Fiscalía pone presión al SII para ampliar investigación a SQM
sorpresa	Por primera vez en Chile, un militar revela que es gay
ninguna	Representante de Orwell acusa a Amazon de ambiguo
tristeza	Indagan desaparición de un adolescente hace 12 días en Iquique
ninguna	Gabriel Hauche está cerca de la UC: Falcioni lo quiere y su representante reconoció contactos
ninguna	Operación Cóndor: todo está guardado en la memoria
alegria	Jefe negociador del Gobierno colombiano asegura que FARC dejarán las armas
anticipacion	Municipalidades realizan Asamblea Nacional durante la cual darán a conocer su agenda
ninguna	Iquique logra un agónico empate ante Cobresal y ambos equipos siguen sin ganar en el Apertura
anticipacion	Mujica llega a la Casa Blanca para reunirse con Obama
miedo	Divulgan al virus que podría destruir el formato USB
sorpresa	El hombre más alto y el más bajo del mundo, juntos en Londres
ninguna	"Alcalde Carter asegura que su continuidad en la UDI está en ""período de reflexión"""
ninguna	Todas las figuras, incluido José Tomás, presentes en la Feria de Málaga 2014
ira	Insurgentes suníes capturan localidades en Irak
sorpresa	Gurú durmiente: no saben si murió o está meditando
sorpresa	¡Dejen de acampar fuera de nuestras tiendas!, sugiere Apple
confianza	"Protagonistas de ""Los años maravillosos"" se reencuentran a 21 años del final de la serie"
confianza	Estudiantes buscarán enviar videos, fotos y mensajes a Marte en 2017
confianza	Estudiantes cota mil bajan a La Moneda para protestar contra proyecto de aborto terapéutico
sorpresa	Inédita propuesta de la UEFA: Si un jugador lesiona a otro deberá salir hasta que el rival se recupere
anticipacion	CChC espera cambios en Reforma Tributaria para acotar impacto en precios de viviendas
confianza	Ex presidente Frei: La actitud del gobierno peruano no solamente es inamistosa,  ya es agresiva
anticipacion	OMS dice letal virus MERS no constituye emergencia global
tristeza	Al menos un muerto tras colapso de viaducto en Belo Horizonte
anticipacion	Puerto Montt: Colegios sólo podrán suspender clases en caso de verse afectados por temporal
ninguna	Bouchard supera a Halep y será la rival de Kvitova en la final de Wimbledon
aversion	Rabat prohibió 30 periódicos extranjeros en 2014 por atentar contra valores
ninguna	Parlamento alemán aprueba ley que establece salario mínimo de 8,50 euros la hora
anticipacion	Gutenberg Martínez: “La Nueva Mayoría es un acuerdo político-programático que tiene fecha de caducidad”
ninguna	Las dudas que busca resolver Sampaoli ante Egipto a dos semanas del debut en el Mundial
confianza	NOAA pide mantener guardia en alto ante temporada de huracanes
confianza	Se acabó la espera: sectores rurales y semi urbanos tendrán acceso a internet banda ancha satelital
aversion	Presidente de comisión de RR.EE. acusa a Contralor de complicar relaciones con Argentina
ninguna	Iglesia de Bolivia convoca a colecta nacional para financiar actividades del Papa en el país
anticipacion	"Los ""buzones para bebés"" cumplen quince años en Alemania"
ninguna	O'Higgins confirma a Facundo Sava como reemplazante de Eduardo Berizzo
sorpresa	Denuncian que Kate Middleton fue víctima de pinchazos telefónicos en 155 ocasiones
aversion	Hijo de exgobernador mexicano es detenido por encubrimiento tras vídeo con capo
confianza	El patriarca sirio-ortodoxo condena la persecución de los cristianos en Mosul
tristeza	Garín es eliminado en Challenger de Sao Paulo y Lama es el único chileno que sigue
sorpresa	Autoridades sudanesas explican que joven absuelta de apostasía fue detenida por portar un documento irregular
ninguna	Walker se aferra a postura del Gute y advierte contra “hegemonía de la izquierda” en la Nueva Mayoría
anticipacion	Apple presentó un nuevo software para iPhone, iPad y Mac en la WWDC14
tristeza	Una turba quemó vivo a un hombre sospechoso de violación y asesinato en Bolivia
anticipacion	Colombia: Presidente Santos manifiesta su apoyo al uso terapéutico de la marihuana
anticipacion	Bolsa de Tokio cierra a la baja desanimada por datos de empleo de Estados Unidos
confianza	Perdón, me equivoqué
aversion	"Tiburón y ""Animal"": la dura crítica de los medios ingleses contra Luis Suárez"
tristeza	Cuatro obreros mueren aplastados por derrumbe de un muro en Guatemala
confianza	Prisión preventiva en Marruecos para miembros de red que reclutaba yihadistas
ninguna	"Presentan oficialmente un adelanto del nuevo juego ""Mortal Kombat X"""
ninguna	Spotify ultima un acuerdo para captar US$ 400 millones y aumentar su valorización
anticipacion	"Guionista de ""Transformers"" dirigirá la tercera parte de la última trilogía de ""Star Trek"""
confianza	"Madre de alquiler tailandesa a pareja australiana: ""Estoy dispuesta a perdonarlos"""
ninguna	Hija de Piñera cuestiona Reforma y pone a La Roja de ejemplo
sorpresa	Astrónomos encuentran un diamante del porte de la Tierra
anticipacion	Ejército colombiano acusó a las FARC de secuestro de hija de jefe policial
ninguna	Cristóbal Saavedra se impuso con solvencia en el Futuro Georgia 3
ninguna	Carlos Carmona revela que Gary Medel le aconsejó firmar por el Sevilla
confianza	Asesores de negociador de paz del Gobierno colombiano valoran retomar tareas
anticipacion	Clima seco acelera producción brasileña de azúcar pero daña cultivos en desarrollo: Unica
confianza	"Diputado Arriagada justifica su abstención en votación por salario mínimo: ""Es un monto pequeño"""
confianza	Fiscalía intentará anular fallo que absolvió a acusado por bombazo en retén de Las Vizcachas
anticipacion	Novedades y lanzamientos del evento Google I/O 2014
anticipacion	Canciller Muñoz llega a Asunción para ser parte de asamblea de la OEA
confianza	Presidente cubano Raúl Castro recibe al líder saharahui Mohamed Abdelaziz
ira	Más problemas para Justin Bieber: Es investigado por intento de robo
ninguna	Cifran en 1.500 los asistentes a marcha convocada por trabajadores del Transantiago
tristeza	Hombre preso en Cuba por instalar redes ilegales de internet amenaza con quitarse la vida
anticipacion	"Padre de Agüero dice que su hijo se ""iría encantando"" al Barça, pero que el City no lo deja"
tristeza	Libia: Mueren 22 en lucha por control de aeropuerto de Trípoli
sorpresa	Parte en Ginebra juicio a ex jefe de la Policía de Guatemala por la muerte de 10 personas
tristeza	Son ya 238 muertos en la mina turca y 120 están aún atrapados, según Erdogán
confianza	Perú y canadiense Bear Creek avanzan en negociaciones con comunidades por mina Santa Ana
confianza	Jonathan Fabbro admitió que tiene como “prioridad” llegar a Colo Colo
aversion	ENAP: Bencinas subirán por tercera semana seguida y acumulan alza en torno a $30 por litro
confianza	Gobierno sirio destina 44 millones de dólares para ayuda de emergencia a Homs
anticipacion	Cuatro jóvenes son declarados culpables de robo con homicidio en La Unión
ninguna	El candidato izquierdista Tsipras quiere que Europa acabe con la austeridad
ninguna	Con música en vivo recuerdan esta noche al folclorista Héctor Pavez
anticipacion	Producción Industrial anota incremento de 1,2% interanual en abril impulsado por sector minero
sorpresa	Perú: holandés asesino avanza gestión para casarse
tristeza	Italia: mueren 14 migrantes procedentes de Libia
ira	Expertos enviados a investigar caída de avión malasio denuncian trabas de los prorrusos
anticipacion	Bolsa de Tokio cierra a la baja por inestabilidad en Ucrania y subida del yen
anticipacion	No habrá Asamblea Constituyente
sorpresa	Descubren fósiles de 300 millones de años de antigüedad en Puchuncaví
anticipacion	Las teorías sobre las misteriosas esferas de Costa Rica
ninguna	Reconocido escritor mexicano publica libro sobre fútbol desde una óptica literaria
ninguna	Con traje de baño de leopardo: Serena Williams se coló a una boda playera
confianza	Masiva marcha reinstala poder estudiantil en la agenda y presiona al gobierno para ser parte activa en la reforma educacional
ninguna	Johnny Depp no deja de lado su interés por la música y  vuelve a tocar junto a Aerosmith
sorpresa	Antidepresivo reduce producción de proteínas vinculadas al Alzheimer
confianza	"Diputado Sabag tras polémica con Bolivia: ""En ningún caso he hecho una declaración de guerra"""
aversion	Policía venezolana detiene a unos 80 estudiantes durante protesta en Caracas
anticipacion	Cómo se fraguó la “rebelión” de los profesores contra Gajardo y el distanciamiento con el Mineduc
aversion	Más de la mitad de los pobres considera que la atención de salud es mala o muy mala en Santiago
anticipacion	Kerry: tropas rusas se retiran de frontera con Ucrania pero aún hay peligro
tristeza	Ocho muertos en bombardeos y combates en ciudad iraquí de Faluya 
anticipacion	Empresa lanza carcasas para el iPhone 6 aunque aún no es anunciado oficialmente
anticipacion	Tasa de desempleo promedio de la OCDE se mantuvo estable en marzo en 7,5%
confianza	Guardia costera italiana rescató a casi mil inmigrantes procedentes de Libia
sorpresa	"Culpan a las ""50 sombras de Grey"" de disparar las enfermedades de transmisión sexual"
confianza	Ex Presidentes llegan a La Moneda para analizar memoria de Bolivia ante La Haya
sorpresa	Niña de nueve años hace skate como una profesional
anticipacion	Principal partido de la izquierda colombiana se abstiene de apoyar a Santos
