tristeza	no he ganado el gordo   
alegría	Adivinen quien cumple años el sábado?  
desagrado	Uhhh para que me acordé   
no sabe	yo    subir banda de escrachos a ig
no sabe	AHORA SÍ   
alegría	free visa to turkey   
no sabe	El 9 de enero SNK               
miedo	Bueno aparentemente en Córdoba no estaría habiendo ni una persona sin COVID.    
disgusto	"La comparación con el debate de la ley antitabaco, donde se justifica la sanidad universal gratuita porque es una adicción y, claro, tiene disculpa     No se trata de que sea una enfermedad ""justificada"", señora. Se trata de que se proporciona sanidad gratuita universal o no."
sorpresa	Me compre hace un tiempo atrás un perfume Channel en la Zofri, 89.990 me salió   .. Dije ctm la huea cara (pero no importa trabajo y me saco la cresta). Ayer fui al Mall en Chillán mismo perfume Channel pregunte valor y me dijo la niña:
tristeza	Y encima me van contando x ahí q eres buena novia    ️
no sabe	Oye una pregunta: ¿Cuantos de vosotr@s sois la segunda cuenta de otra principal que también me sigue? Es que siempre me ha intrigado eso.      
no sabe	Le diría para ir al cine y recomponer lo que pasó pero siempre su respuesta es no y que con otro la pasa mejor. Se olvida que todo empezó en el cine   
ira	Va ignorame, pero a ver quien te deja comer ensalada de manzana de sus chichis  
desagrado	ya empecé mal el día olvidándome los lentes de sol   
confianza	Mañana tengo el último examen de diciembre y estoy de blancazo, no retengo nada a parte de la parte práctica y me da realmente igual  
no sabe	Tener que bloquear la tarjeta de april solo por mi paz mental  
ira	    NO ME LO PUEDO CREER! ¡ME HA TOCADO! ¡ME HA TOCADO! ¡ME HA TOCADO LA DESGRACIA DE ESTUDIAR EN LA UNIVERSIDAD DE VALLADOLID! ¡COMPARTE EN TU MURO SI TÚ TAMBIÉN!
tristeza	Estoy a punto de colapsar   
sorpresa	Ciro ni me mira, anda loco   
tristeza	Quedan 3 dias para navidad  
sorpresa	¿Se fijaron; que ayer fue el último día 21, del año 21, del Siglo XXI?     
tristeza	Cuando me preguntan por qué no me quedo con cosas de accesorios, es porque no me dan tiempo a quedarme con algo    vuela to
disgusto	LA DOBLE MORAL  Todos defendiendo a Mark Anthony por su fama y demás pero si las muecas las hace el Tata, algún picotero o hasta el mismo Silvestre que un día por algo parecido le cayeron encima, todos estarían hablando buena monda. De burros y periqueros no nos iban a bajar.      
no sabe	Hoy en día existen muchas blockchain con estructuras diferentes, eso significa que les cuesta comunicarse una con otra.      Allí es donde entra Polkadot, uniendo a todas las cadenas y permitiendole al usuario moverse casi sin darse cuenta entre ellas.  (36)
desagrado	    NO ME LO CREO  ME HA TOCADO         _ME HA TOCADO LA SUERTE DE NO SER UN PUTO GABACHO  _
no sabe	Momentos en los que quiero saber coreano   
ira	No puedo dormir porque no puedo respirar    maldetaaaaaa gripe.
alegría	 Mami, ¿Jesusito tiene villano? Sí que tiene, sí. Pero no vamos a hablar de él todavía.    
desagrado	un nene peque de mi finca diciéndome que los reyes me iban a traer carbón... he estado a punto de contarle la verdad sobre esos reyes suyos 
desagrado	Para los que quieran colapsar trabajen en un call Center   al borde de la depresión y el máximo estres
confianza	Trabajando en los últimos pedidos antes de Navidad  Muchísimas Gracias por vuestra confianza a la hora de encargarme vuestros regalitos  Deseo os guste el resultado... y deseo que paséis una Felices Fiestas    Abrazos Gigantes   Terapias y Artesanía  Link in Bio
alegría	Estoy trabajando y no traje desayuno y nada más fue que dijera que tenía hambre para que me compraran de comer. Amo ser la consentida de la gente     ️
ira	Consejo del dia... Cierren el put... Ciclo... Y sean felices!    Con mucho amor les digo
desagrado	Que vayas al endocrino y,en los tiempos que estamos,te diga que no tomes proteínas, que son malas para el hígado y que tienes obesidad según el IMC...ese es el nivel   
desagrado	Y lo que más gracioso me parece es que en el trabajo parece que no se contagia (y eso que casi nadie teletrabaja ya, yo y dos más).       No sé Rick, pero ya no saben ni lo que hacen.
tristeza	Loco, puede ser que disney haga películas tan profundas? Me van a matarrrr     
desagrado	Otra vez el mismo sueño   
ira	Re caros están los juguetes   
no sabe	has lo q yo digo pero no lo q yo hago   
alegría	por otro lado jugar al tft me da ganas de vivir, estoy a 10 lp de orito   
no sabe	❗️ Existen cientos de pseudoterapias enfocadas a prevenir y tratar el cáncer. ¡Cuidado! Consulta siempre con el oncólogo.   Hablar de ellas es la mejor forma de conocerlas y poder evitarlas.
alegría	Que lindas fotos de perritos y gatitos en respuesta a Brownie    amo mucho
desagrado	LEESEO      
sorpresa	dios mío como voy a ser hija de una clasista 
alegría	TAEWOO va a debutar    no crei el rumor pero agradezco sea cierto,me gustaban los integrantea del grupo y el era muy lindo con los demas y gracioso   ️ estoy feliz
no sabe	He retomado el Witcher   
sorpresa	¡86.148! Ya tenemos el gordo      
desagrado	El PP apoyó ayer en el Senado, a las lenguas cooficiales en España. O sea, que apoya a los independentistas catalanes que no dejan hacer pipí a los niños si no hablan catalán y también a ETA  ¡Me quedo muerta!        
no sabe	Hice algo muy chilango en Quintana Roo; pregunte de qué eran las quesadillas del buffet 
alegría	 No me dejes    + No te dejaría por nada en el mundo     …   ️
alegría	Hoy comenzó muy bien el día   
no sabe	0 euritos en la loteria de navidad 
no sabe	Madre mía las farmacias en el centro de Madrid. Ponen carteles de NO HAY TEST. Han arrasado con ellos    Locura total.
alegría	Conoci el video de Tom Holland bailando umbrella   
tristeza	mis manos huelen a pezcado
no sabe	Otro año currando!!!   
no sabe	Estoy así   de hacer una cuca y una picada para mi familia
ira	ni nada .... Bien pues ahora mísmo mi hija tiene fiebre ... Y ahora que .... Pues a denunciar a estos médicos y enfermeras , que nos proporcionaron un trato malísimo y despectivo ....  Bueno este es SALUD NO RESPONDE y la gente que te atiende tampoco        
no sabe	Quero fita   
alegría	Empezamos bien el día   
disgusto	Necia la gente que quiere poner pura banda porque está hasta la Vrga cuando todos traen el perreo aún   
sorpresa	Tuve un sueño bn raro 
alegría	hoy tengo tareas de admin de gc omg omg    KEKW
desagrado	Bruno anoche buscando nombres de bebes que quedan bien con apellidos españoles osea el suyo    Sal de ahi Satanas 
ira	Que rabia, lo quiero solo para mi  
desagrado	No entiendo por qué hay personas que escriben mal su propio nombre   
alegría	Por fin se ha puesto Juanjo al día con One Piece y puedo comentarlo con él       ️  ️
tristeza	cada vez se hacen menos speech de año nuevo   _    ️
disgusto	Me enferma que sean tan irresponsables   
alegría	Not el baterista de cinema tocando la batería después de diez años para el día de hoy y tocando forever or never   
disgusto	Que fiebre tan malparidaaaa      
alegría	Que lindo sentirse de la familia en una que no es la tuya   
no sabe	Mañana ya es jueves   
sorpresa	Porque a tantos les molesta que Barracas Central allá clasificado a Primera? Si Boca tiene que jugar allá cuál es el problema?      
ira	QUE CALOR SORECHUCHADETUMADRE     
alegría	Que dicha    
no sabe	En esa realidad es paciero de Japa   
desagrado	Sí, te voy a responder el mensaje hombre que tiene como foto de perfil un ripio   ️ 
desagrado	Ay oye yo no me quiero ni peinar me siento tan comoda   ️(como una loquita)   además que si salgo por ley me tengo que bañar pq el COVID anda desatado   
desagrado	"*en LAS tiendas (no ""en más tiendas""   , corrector metido!)"
desagrado	La próxima vez, no voy a hablar de más..  
sorpresa	ON live : he estado jugando mucho al tablero de ajedrez. Por lo que mis dedos tienen esta forma.
no sabe	Reflexo      
desagrado	Cómo le digo que no le aguanto    sin decirle que no le aguanto  
desagrado	nomás se lo perdono a Yeonjun   
alegría	Que reto tan grande es guardar el secreto del sexo de mi sobrinit@ hasta el 1ro de enero   
alegría	Los cuellos de tortuga con el cabello como lo traigo se debe ver genial
confianza	La verdad yo estoy muy ocupada y el silencio de Kep1er pues no me importaba mucho pero creo q ya llega un punto en el q empezó a notar su ausencia pq hay 0 contenido. La verdad, ya es preocupante pq no mucha gente es capaz de esperar tanto  como digo yo voy a esperar paciente
disgusto	Al menos es curro para Lo Del Año Que Viene        PERO MUCHO CURRO      
alegría	Buennnn dia 
alegría	Hola amigos Buenos días cómo estás, bendiciones un abrazo  
ira	Una semana trabajando y ya no soporto a la gente, tan mal educada va a ser?. Y encima siempre el cliente tiene la razón   
sorpresa	Una semana para mi cumple   
desagrado	un dia me hace llorar y hoy estoy aqui en el sofa con el  
miedo	el doctor strange    yo verse todo el percal y no decir una sola palabra
alegría	la navidad  ️  ️  ️  ️  ️  ️    
alegría	Hoy será uno de esos días donde le llega a uno el regaño de navidad adelantado, jaja. Morning bitchs.   
no sabe	   Ojo si tenía previsto acudir a alguna actividad de Nadal en Ames, porque el incremento de contagios de covid obliga a hacer cambios en la programaciónhttps:www.cope.esn1692362
alegría	¡NO ME LO PUEDO CREER! ¡ME HA TOCADO! ¡ME HA TOCADO!   seguir siendo igual de sexy otro año más  
alegría	yo:  *fernandocosta sube vídeos con su yaya* yo:  ️  ️  ️
anticipación	Se puede tomar igual en el día que te vacunas?   
no sabe	El 148 era el teléfono (fijo, claro) de mi yaya. De cuando nos los sabíamos todos. El gordo me la ha traído 
