desagrado	No estaba en mis planes vacunarme de covid, pero bue.  
tristeza	Estoy tan aburrida que pensé que era domingo y recién estamos a sábado   
sorpresa	16 mins pa llegar   
anticipación	Menos de 10 dias pro ano acabar   
disgusto	Lo malo de tener padres religiosos es que te vendan todas las pajas de la biblia, perdonar al prójimo, la unión familiar, estamos hechos a las semejanzas de dios y pare de contar   
sorpresa	En qué momento pase de recibir regalos a ser yo el mismísimo  PAPA NOEL    
no sabe	mi mamá poniendo el radio en su teléfono si aplica la de hasta que truene la bocina   
desagrado	No hay cosa que odie más, que la impuntualidad loco  
alegría	Estoy en el metro sentado frente a un chaval de 15 o 16 años que está leyendo un libro... ¡En papel! Hay esperanza... 
no sabe	Ayuda como rayos uso ig       
no sabe	Esta lloviendo y el agua moja
alegría	Me he cambiado la fotito de perfil uoooo   
desagrado	Si yo tenía q magrudar, por q razón me acosté tarde?  
no sabe	Tercera dosis anti covid y en camino para la cuarta algo no anda bien.      
desagrado	mi mama debe estar podrida de que le diga algo y le termine diciendo a último momento que no, va a terminar diciéndome que no todo el tiempo   
sorpresa	He ido al Aldi a comprar un roscón de reyes, con la firme intención de NO COMPRAR NINGUNA PLANTA  ¿Cómo creéis que ha acabado la cosa?   
alegría	Mañana en la barra sonarán villancicos tipo:  La isla Monastery  Sigue bailándome  Cositas así   
confianza	El COVID dijo: pero como que volví, no entiendo, si yo nunca me fui   
anticipación	Esperando mi visita  
ira	Jazmin d mierda cada vez que allyson duerme con nosotras se va con ella ta bn así son que vaya allyson a comprarte los kilos de cat chow que pedis x mes  
alegría	Uno pensaría que Cristiano Ronaldo tiene TV en su cuarto   
alegría	Buenos días!! gracias Dios por otro día junto a lo más que amo mi hijo, gracias por bendecirnos siempre no puedo esperar para ver que nos traerá este 2022 espero que sean muchas más bendiciones ya estoy lista.  
desagrado	pienso en el baile y siempre la misma pregunta, que mierda me pongo!?  
miedo	Tembló la tierra, y fue bien fuerte   
disgusto	Ya me cansé de jugar el mismo jueguito de hace aprox. 12 hs   
confianza	el catalan es 1 idioma mui bonito  existe el verbo trontollar
tristeza	m he peleado con unas d mi clase   
anticipación	Por cierto que el año pasado dije que nunca más iba a jugar al amigo secreto…   
desagrado	Muchos a esta edad ni aun debutan o tienen menos que 10 partidos en 1era. Sergio ya jugó en el club mas grande de su país, salio campeón, metió en un clásico siendo niño, lo compro el club mas poderoso del planeta, fue a Brasil, México. Todo con 23 AÑOS   
desagrado	Parishiiii emplaza a Boric por los medios.  Pero q se lo diga a la cara    que venga y se lo diga a la cara
disgusto	ala ya no me toca el gordo  
sorpresa	yo hablo demasiado o la gente habla muy poco   
alegría	Feriass   
ira	Re podrida de soñar siempre lo mismo   
tristeza	AHI VOY 2022  ️.!  El viernes 31 de Diciembre a las 23:59 miraré al cielo y diré: “Hasta aki te kise, Hasta aki te Ame, Hasta aki te espere..!  ADIÓS PASADO   
no sabe	Yo;     Me acuerdo que esta la CA awards  Yo :   ️
no sabe	Shockeado con las expensas de algunos lugares, 45mil     
alegría	El entrenamiento de hoy fue mítico     ️
no sabe	Ya se me calentó el hocico   
disgusto	Me levanté temprano para ir al centro porque tenía que comprar UNA sola cosa, hasta que me acordé que e 2212 y está todo explotado 
confianza	pero está bien no voy a demostrar q me afecta     
tristeza	a ver cómo le explico yo a mis sobrinos q este año no hay reyes xq se han olvidado el certificado covid en casa       
desagrado	Saco los pies para sentir fresquito y Olivia me los muerde. Querida te podes calmar?   
tristeza	amets te echo de menos 
no sabe	Sobre que no pude dormir en toda la noche mi vieja me despertó a las 08:00   
alegría	Hoy a ver Spiderman no hay weys en casa  
desagrado	¡NO ME LO CREO! ¡ME HA TOCADO! ¡ME HA TOCADO! ¡ME HA TOCADO LA DESGRACIA DE SER DEL ATHLETIC CLUB!   ¡COMPARTE EN TU MURO SI A TI TAMBIEN! 
sorpresa	Bueno no se ni como aprobé portugués pero el finde se festeja  
miedo	Me da miedo que un dia de estos mi cuyito se infarte de tanta pirotecnia que tiran   
anticipación	Se copa la plaza el 24 y el 31??  
anticipación	Mañana a esta hora estoy en una camilla con un laser apuntando a mi ojo   
no sabe	Madre mia, los truenos   
confianza	gracias uma x felicitarme la navidad me las pasare estudiando  ️ 
tristeza	Me quede dormida porque ya no aguantaba el sueño y me levanto con esta noticia que me tomo por sorpresa, me puse mal , estoy mal                   ️
no sabe	Aichino aprobameee
confianza	"perdón pero soy ""heterosexual"" para mis amigas"
desagrado	Sonó la alarma y que rabia.  ¡Perra maldita, antipatriota!   
no sabe	Feliz día para todos mis lindos y queridos seguidores, q este sea un miércoles de muchas bendiciones alegrías y sobre todo de la presencia de nuestro señor Jesucristo  
tristeza	Ahora me agarró dolor de muela, algo mas?   
alegría	Kheee lindos todos los días de diciembreeee   
no sabe	¡NO ME LO CREO! ¡ME HA TOCADO! ¡ME HA TOCADO! ¡ME HA TOCADO LA SUERTE DE SER DEL VILLARREAL!  ¡COMPARTE EN TU MURO SI A TI TAMBIEN!   
tristeza	Alguien más hoy, 22 de diciembre, que no tiene NADA pronto para Navidad? Será que quedaré sin comida?   
disgusto	Hoy me tatúo        
no sabe	Me a moa: bsf a engene:      Ewan ko ba
no sabe	Y si me hago un piercing hoy?      
sorpresa	Seré el karma de muchas personas????     
desagrado	quitaron practicamente todos los discos de ekatarina velika de spotify  
miedo	Me siento feliz y ansiosa   
desagrado	El final de Hawkeye  . No me puedo creer que en menos de una semana Marvel haya pasado de hacer el mayor fan service de la historia a marcarse un Ralph Boner 2.0
ira	Me cago en Juanma y en la educación física         
tristeza	Yo    cagarla siempre
tristeza	mama mia he borrado 567 fotosss! 
alegría	Que buena pedita de cumpleaños   
sorpresa	Un accidente frente a mi edificio, un motoquero se sacó la chucha y quedó atravesado en la calle ...venía curado.  Llegaron los amigos y se lo llevaron al sapu.   
sorpresa	HERMANO VOY A BORRAR ESTO O HANMA ME C0RTA LA CABEZA     
alegría	Buenos días mundo   
alegría	Hoy es día de fiesta   
no sabe	Estoy tratando de empezar a juzgar desde la intención y no la acción. Es la única forma de vivir tranquilo y de intentar entender al otro
anticipación	Y Angely no ha comprado un carro con un año cobrando esos chelitos sin trabajar...?       
tristeza	Extraño cuando mi hermano vivía conmigo DEVUÉLVANME A MI HERMANO   
desagrado	Que lindo dia y que pocas ganas de trabajar que tengo   
alegría	like también he tenido momentos horribles como cada año pero creo que en este puedo ver mas claramente lo positivo   
alegría	Ayer me llegó mucho cariñito   
sorpresa	Oye, yo pensé que Metanoia ya no existía y sigue vendiendo   
tristeza	SINO NAG QRT          
sorpresa	Cómo va a ser el sorteo de la loteria hoy, si yo no he visto ni el anuncio???     
tristeza	Lpm me quedo la cabeza roja 
anticipación	Como sabrán las hojaldras en la freidora      
desagrado	Mis vecinos no dejan dormir porque tienen su música de mierda a todo lo que da    me siento como en obre cuando se enfiestaban afuera de mi depa
no sabe	+ Amor Aller cuando estaba con tigo sentí que algo en mi se rompio..  Hay mi amor q lindo + Y si.. cuando revise fue el condón  Eh?  
tristeza	mi tia me desbloqueo el celular g estaba jungkook motoquerp me quede así        
disgusto	La hora que es y ya empiezo a transpirar, que asco   
no sabe	terminé the oc   
desagrado	No estoy devolviendo nada porque ya me amañe   
no sabe	A que os referis con jimin leg, a la pierna de jimin o a jimin legolas (jimin extensiones)   
disgusto	"Que pena que se estén robando los bonos navideños personas que ni siquiera los necesitan , y acá es donde entra el dicho       ,""vemos la paja en el ojo ajeno y no vemos la viga que tenemos en el nuestro""."
alegría	Hoy me desperté con la noticia de que me habían aprobado la visa. Un buen regalo de cumpleaños si me lo preguntan  
confianza	¿La chica te lastimó tu corazón?  Si    Pues ve y le lastimas la cuca.  Fénix   ️
no sabe	El 24 durmiendo y el 31 re durmiendo 
enojo	Ya salió..el viejo CTM..de la Vega        
desagrado	Ahora nadie me contesta 
alegría	Feliz cumpleaños, a la más bonita de Colombia    La tierra en la que se fundó el equipo de mis amores, en la que fue creada mi Alma Mater, en la que respiró por primera la vez el amor mío y en la que sueño con un mejor futuro.   Gracias por tanto, mi amada Bucaramanga   
no sabe	⌚ 11:00 Orden   Compra: 6750  6810  maxicambios 6750  6810  myd 6750  6810  chaco 6750  6800  euro 6750  6950  basa 6740  6865  familiar 6730  6840  fe 6730  6830  vision 6700  6850  bnf
alegría	Muy BUENOS DÍAS    COMUNIDAD TWETERA       FIELES E INFIELES  PUEBLO LIBRE Y LABORIOSO
confianza	Soy un loco extravagante   
anticipación	 [22.12.21] ┆10:43PM KST Me vendría muy bien un buen chocolate caliente espeso
tristeza	Aveces quisiera estar pequeña y disfrutar de la navidad  
tristeza	Wandavisión Loki What If Hawkeye Capitán America &amp; Winter Soldier  Mi top de las series post chasquido  
desagrado	Primera vez que, porque hace calor, me pongo el ambo solo sin remera abajo y ya estoy molesta. Maldito cuello escote V, se ve todo.    
no sabe	Quiero mutuals   
ira	menstruación    
tristeza	A este paso, me va a tocar comprar los regalos de navidad el 1 de enero. El tiempo no alcanza
sorpresa	Me acabo de enterar que The Veronicas sacaron un nuevo álbum   
disgusto	Me he dejado los auriculares    en Salamanca   _ una genia soy
desagrado	  ️ Oyes, si no queréis correr riesgos en las comidas navideñas con la bicha, no las hagáis, yo no hago nada y ya ves, taaaaaan normalito como siempre.  (Anda, bloquea las respuestas)   Nah, tengo la relevancia de un grillo mutilado con artrosis.  (Eso también)
sorpresa	alaaaaa  , pero si es un todos con todos
no sabe	Buen momento para que las cordales duelan hdspm   
confianza	Antes yo era buena, ahora lo sigo siendo, pero no con todos.  
desagrado	Me despertó el dolor de hueso   
alegría	Mi mejor amiga se tomaba todo con seven up hasta que le enseñé a ligarlo con canada dry, ahora Nama e asi Que bebe 
alegría	Qué chimba parcerita...
ira	Btw hace mas de dos años que retrasaron minions 2   
no sabe	En RD🇩🇴 No Se Dice Permiso   Se Dice:
no sabe	Lanús    Banfield  Reírse de la gallina de la B Quilmes
no sabe	La actualidad del fandom ahora:  Alterados porque Karol confirmó que va a ver Tour para el siguiente año   
tristeza	el tren por tu casa   
ira	Estoy muy cabreado con los cabrones y cada dia mas ladrones y que el estado español les permita a los bancos robar como roban me estoy refiriendo a las comisiones desmesuradas que te cobran          
sorpresa	Vaya día de locos que llevo, madre mía   
enojo	Odio esos manes que te dan los “buenos días” o “buenas noches” después de haberte desvestido con la mirada y si uno no responde te llaman mal educada.   MIRA HP, ESO NO ES EDUCACIÓN ES ❗️ACOSOO❗️
no sabe	"Parece ser que la multa es sólo si vas a trabajar, ""pudiendo"" trabajar desde casa, por lo que la policía deberá comprobar si ese es el caso. ¿Y el consentimiento para entrar en el domicilio? No hay flagrante delito ni resolución judicial.  Ah, que si no le ponen la multa.  "
desagrado	Que linda hora para ir a la dentista 
desagrado	Actualmente estoy huyendo de los spoilers de spiderman. No he tenido tiempo 
alegría	En algún momento llegue a pensar que no merecía lo suficiente, pero en el lugar correcto lo eres todo    
no sabe	Si te peleas con todos los del trabajo y entre ellos todos se llevan bien, quién es el problema?      
sorpresa	Tuve un sueño inception, soñé que estaba soñando y luego estaba comentando el sueño en el sueño   
desagrado	Las filas de los servicarros para las pruebas de COVID están ocasionando un tapón descomunal!! El de la carretera 887 en Carolina está que da hasta miedo!!!    
desagrado	Eso de andar bien dopado me quita el sueño siempre   
alegría	le regale lotería de navidad a jordi ahora tenemos 200€ para irnos a comer 
no sabe	una cabaña, paisaje nevado, hogar encendido y mi gorro de mamá noel, pensalo (?!)    
anticipación	Estoy confundidisima   
no sabe	Cuando en la tele se habla de ‘ha caído el Gordo en un barrio trabajador’ no entiendo si es que la gran mayoría de barrios no trabajan o algo…   
confianza	No sólo honramos a Dios trabajando adecuadamente ,   en el tiempo y forma correctos,   sino también descansando y divirtiéndonos adecuadamente,   en el tiempo y forma correctos  El descanso importa. Y mucho.
tristeza	Planear en mi cabeza conversaciones que no van a suceder es mi pasión   
ira	No tome ni mierda, y por tomar un maldito trajo de bols no paro de vomitar     
alegría	Que rica siesta me he mimido     ️
disgusto	Puto sueñoooooooo 
no sabe	Que feo clw golpiarte y no poder ir ha trabajar x un mes y algo no pode hacer ni bosta y andar seco
tristeza	¿Hoy ha habido tongo como lo del año pasado o no?   
alegría	Mi papá terminó comprándome el body que tanto quería   
no sabe	FELIZ CUMPLEAÑOS LOUIS &lt;33    
desagrado	clases a las 8:30... Me despierto a las 5 a las 6 , a las 7 y llego media hora temprano    háblame de ansiedad.
sorpresa	¡Número íntegro en San Pedro Alcántara!           
anticipación	Si una mujer te favea un tuit ¿es que quiere garchar con vos?      
desagrado	Mamá diciéndome que quiere que la lleve a ver Matrix 
no sabe	Y os sorprende pillar covid después de la Gamergy?   
anticipación	Me muero con la tormenta q va a caer   
desagrado	Quiero ver a todos los posmodernos que defienden el género como una construcción social defender que la raza es también construcción social   
sorpresa	mi para ti de tik tok anda muy personal   
alegría	Mañana es mi egreso, MAÑANA ES MI EGRESO        
alegría	Me aleje de xx personas y mi cabeza se siente liberada y en paz. Estoy rodeada de gente hermosa que está lejísimos del puterío y las malas vibras   me siento en mi mejor momento   
disgusto	Alguien más quiere vender su entrada de la gran navidad   
desagrado	Las ganas de irme que tengo   
no sabe	Pero temprano me dormí anoche  
no sabe	Buen diaaaa bebeeees     Hoy vuelvo a trabajar, la emoción que manejo     ️
sorpresa	Literalmente tengo una novia gótica culona       
disgusto	Todavía tengo que comprar los regalos   
no sabe	Foco total   
no sabe	La maldita costumbre de no apagar el aire y después levantarme congestionada   
no sabe	No tengo permiso de mi papá aún      
desagrado	A mi lo único que me han tocado son los coj..nes.   
no sabe	Si te metes con genshin me la metes a mi también ya no aguanto más soy Virgen           
no sabe	...86.148 por cinco números  
confianza	que quieren que suba hoy?   
no sabe	Mi duda es ¿que le conocen a Taehui?   
no sabe	Fin de año nivel me quedo dormida en el bondi y me bajo 80 paradas después.  Muy bien por suerte, poco estrés y cansancio  
sorpresa	"RÉCORD:   _ ""El Ómicron es el virus que se ha propagado más rápido que cualquier otro virus en la historia""     Bill Gates"
no sabe	Por fa, me podrían explicar como personas que huyeron del socialismo, celebran el triunfo del socialismo en el país que llegaron de inmigrante ? Soy un ignorante en el tema   
alegría	Buen día para todo el mundo mundial Happy Wednesday 🇮🇨🇨🇱  
alegría	NO ME LO PUEDO CREER! ¡ME HA TOCADO! ¡ME HA TOCADO! ¡ME HA TOCADO LA SUERTE TENER LAS TETAS MÁS GRANDES DE ESTA APLICACIÓN!     
sorpresa	Pregunta sería gente!  Empanadas Don Ramon? Referencias?  Los leo   
tristeza	Pedi un kebab y no me dijo amigo el repartidor Sadge 
no sabe	PD. Estoy en la cola de Zara después de haber superado los pasos anteriores   
no sabe	Killian    yo.  Ser productivos y contestar roles ahora.
no sabe	tome muchas malas decisiones este año, pero las anécdotas
no sabe	Porqué el Gordo sólo le ha tocado a gordos??      
sorpresa	Una pareja decide suicidarse saltando de un edificio. Cuando llegaron a la cima, ambos contaron hasta 3. La mujer saltó pero el hombre se quedó ahí. El la observó caer durante 8 segundos y luego la vio sacar un paracaídas. ¿Quién traicionó a quién?   
tristeza	Hace como 4 dias que no como bien y hace como una semana que no duermo nada. Asi estoy   _️
disgusto	nos ha hablado por megafonía el conductor del tranvía    no somos dignos
desagrado	"Fui al centro a comprar el ""cosito"" que engancha las varillas de la carpa, me falta solo uno, no venden, venden la varilla completa. 730 mangos. I en pedo. Mi tía tiene que comprar todas las varillas de la carpa   "
sorpresa	¿Quién me entiende? Ahora estoy feliz   
ira	ME HA TOCADO!!!  seguir madrugando y cagándome en mi puta vida   
desagrado	Gente con temas artísticos: Tenéis que pagar a los artistas, su tiempo vale dinero      Gente cuándo no les va el ordenadormóvil: Oyee tú eres informático no?? Podrías ayudarme? (Obviamente sin pagarte somos amiwis jeje)
no sabe	hace 11 años lo llamaba por su cumpleaños        ahora están juntitos durmiendo   ️
no sabe	Ferran  .....  
sorpresa	Y todos estos comediantes expertos en deportes que han salido en las redes?!     
miedo	Hablar de nosotros eso es haram
no sabe	Hay un chico en el gym con los pantalones del revés con muchas etiquetas colgando, le aviso o le dejo darse cuenta en su casa ?   
desagrado	"La experiencia de Dana Miró para alcaldesa de Guaynabo ...""camino con el alcalde, trabajo en wic , su papa es pnp de clavo pasao "" tremendo   "
ira	ay que bronca la puta madre  
desagrado	Cómo está costando este día 
tristeza	Ahuevo quieren sacar a Gertz Manero   
alegría	Arriba jaja pense que me habian dado vacaciones me voy a santa maria 
desagrado	De vacaciones y levantándome temprano   
no sabe	Vaya por dios, otro año sin ser rica.   
ira	A mi no me pongas “mismo manejo” mándame alv mejor...   
confianza	Será que enamoro a alguien en 2 días para pasar navidad juntos ?     
no sabe	Me apetece un bocata de salchichas a la brasa  
desagrado	Muy temprano para deprimirme, mejor me duermo jaja 
tristeza	Cual fue el momento de quiebre donde todo se vino abajo? Y yo acostumbrándome a eso   
anticipación	Volver a bari con los viejos es hermoso, pero a cambio tengo que entregar mi salud mental   
no sabe	Que ganas de estar con los de siempre fumando porro y tomando birra   
alegría	Me autoregale para navidad una gorra Snap new era de la NBA. Me salió un ojo de la cara, pero si doy vueltas no me la compro más. Estaba entre la de Golden state, los raptors o la de Denver. Mi corazón fue por Campazzo   🏀
no sabe	Llegué media hora antes al trabajo   
tristeza	Mal ahí re extraño a mis amigas, cuando éramos todas desempleadas estábamos mas juntas q hago renunciooooo    
no sabe	De cr quente logo cedo   
sorpresa	Ayuda no puedo salir del subsuelo de Pokémon Perla es taaan adictivo     
alegría	"Que pedo mi sobrina diciendo ""awuaaaa"" a los 3 meses   "
desagrado	Los zurdos deben estar nadando en un lago de baba. Boric piensa en la reforma de la Constitución, y entre los integrantes de la Convención Constituyente hay una MUJER Mapuche.    .
no sabe	 ¿No me hará daño acabar el año así ?   ¿así cómo?    sin unas Nike dunk x off white   sin unas Yeezy 500 desert 
disgusto	ya no puedo fantasmear a las personas.  
no sabe	años defendiendo el spiderman de andrew para q ahora sea el favorito de todos     os odio
tristeza	Pues nada, no soy millonaria   
tristeza	Odio eterno al calor asqueroso.  
no sabe	Esta noche buena me la voy a pasar jugando al animal crossing 
tristeza	Hoy en día nadie es confiable  felices fiestas para todos   ️  ️  ️
desagrado	Hoy la V hace la fiesta en el freezer  ⚪
no sabe	Casi adoptó un perrito pero encontré su dueño y quedó en buenas manos   ️  
desagrado	Tengo que lidiar con eta muchacha y también su playlist de Demi Lovato? PUES MIRE QUE NO que yo no soy tan generosa ni buena gente   
tristeza	No me digas que El Gordo no ha caído en Doña Manolita       
no sabe	Dice AMLO que Gertz Manero se queda, ¿Ya les quedó claro?      
desagrado	Arrancamos la época de desayunar sambuchitos, almorzar sambuchitos , merendar y por supu cenar sambuchitos   
sorpresa	Mi hermano ya paso a secundaria en que momento creció tantoo     
tristeza	Como me miro el drama si ni las páginas que los transmiten ilegalmente me funcionan   
desagrado	Grave error   Jamás me había metido en ese tipo de charlas de audio, hoy lo hice, pero no caeré otra vez   Flojerita…. Descansen   ️
alegría	Buenos Días   Feliz Miércoles    ️
no sabe	se acuerdan que ale tiene un tiktok que la AriGameplays le dio like y ahora JuanSGuarnizo sabe quien es ana y ale amiga en los streams The Circle Of Life     ️
disgusto	Los cajeros de san gui o no funcionan o no tienen dinero nunca durante la semana   
anticipación	Mañana me toca la tercera dosis!   . Cómo les ha ido a ustedes…?
desagrado	Estoy de vacaciones y me hacen madrugar   
desagrado	Tremenda siesta me voy a echar, me cago en Dios     
no sabe	pq se puso este sábado   
alegría	Hacia tiempo no dormia desnudo y buaah que bien dormí     ️
disgusto	Un 25 de mierda   
confianza	Mientras haya salud...  
desagrado	Este mes está como que muy largo, no veo la hora de que se acabe ya   
tristeza	Todas mis ex parejas siempre confiaba con la demás gente, pero no el amor de su vida (Como voy a creer en con el amor   ).
desagrado	En mamada #43821 que ocurre en mi hospi:  Ayer la enfermera especialista del turno vespertino no me quiso entregar hasta que entrara el especialista de mi turno porque “sólo entre especialistas”  La morra tiene posttecnico…   
ira	q bronca despertarme antes de que suene la alarma   
tristeza	gente perdón x estar tan inactiva  pero cuentenme... que les regalaron???
alegría	Yo también quiero churritos con chocolate   
tristeza	Ya no hay buenos días Bart, solo días.   
no sabe	Desde hoy habrá que descontarle un minuto al día y agregarle un minuto a la noche.    
desagrado	Lo que celebra chile es el final de el sistema productivo! Típico de pronto lo empresas se unen y paran sería bueno si  
ira	Una quiere volver de la gira y q este su re amor en la cama y no ,lo único q hay es la pila de ropa que me probé antes de salir y la perra con el culo en la almohada  
no sabe	Segunda amanecida sin cabecear.... Ahora al rancho como papá noel   
desagrado	Madrugar no es lo mío. 
tristeza	Lo unico que quoero es estar bien 
sorpresa	Acabo de escuchar el petardazo en forma de trueno más fuerte de mi vida          vaya pepinazooooo
confianza	Vamos a por el carnet de moto 
tristeza	Q complicado es responderle a las antis en ingles           
tristeza	Necesito un regalo de última hora   
alegría	feliz cumple louis  ️  ️  ️  ️
sorpresa	Q son estas ganas de cortarme el pelo cortito otra vez?  
sorpresa	Fui a sacar efvo y solo tenían 2mil. El flaco me miró con cara de y si negri son las 7a.m.   
disgusto	Despierta desde las 5 de la mañana, gracias lluvia   
alegría	Por suerte ni me queme 
no sabe	Papo de R10   
no sabe	Michael hayup amina design  
no sabe	Mascara     ️
sorpresa	Leoescucho que Bordalas ha pedido fichajes, que se busca un central y un mediocentro, que no se descarta un delantero, que suena Godin, Gonzalo Villar, etc  Pero Héctor Gómez dice que es imposible fichar.   ¿No será otra mentira de Héctor para intoxicar verdad?      
no sabe	Tus perros ronquidos no me dejan dormir        
tristeza	puse la ss incorrecta   
anticipación	Artista = Art Insta ?      
no sabe	Lrt Fjfjfjfkfkfk     
alegría	Mi papá ya abrió el regalo que le di y le encanto     ️
no sabe	Oficialmente, los últimos entrenos del año se acaban hoy. A descansar hasta enero.   ️ 
alegría	Que lindo 24 veo venir adentro de fez con mí familia .  
alegría	HOY ME LEVANTÉ RE LOCA   
alegría	Aaaaaaaaaaaaaaaaaa qué lindo    ️
desagrado	"Es que qué es eso de ""las sobras"", como si el tiempo invertido en alguien no valiera nada si no es tu pareja, no sé, feísimo me parece "
no sabe	A media mañana reunión de comité. Envíen buena energía que se define el budget del año _    .
confianza	el dia q decore mi cuarto con cosas de mis favs no kiero q mi familia se quede a dormir ahi en serio duerman en la sala no me importa si vienen de visita solo no vengan mejor   nomas mi abuela y mis papas
confianza	Oigannn, nunca se crean el ya voy llegando y menos de mi  
desagrado	Pareces la policía Nacional Controlando quien te deja de Seguir O No. Aflojaaa   
no sabe	40 min esperando a vez na van   
alegría	Uy, ya tengo una novia     
desagrado	quiero dejar los lentes pero no puedo usar d contacto     
sorpresa	Estas re tranqui y de repente faltan DOS días para navidad
ira	Culia no se si vender la entrada de la gran navidad, o esperar para ver que onda o ke   
alegría	Enganchado de rock nacional para viajar en tren  
tristeza	El sorteo de la lotería de Navidad me pone melancólico   
no sabe	Esa es la que le cae   
tristeza	Levantarme de mal humor es lo peor que me puede pasar   
tristeza	Dia triste  
disgusto	nuria deja de tomar café  
alegría	¡NO ME LO CREO! ¡ME HA TOCADO! ¡ME HA TOCADO! ¡ME HA TOCADO LA SUERTE DE SER DEL VILLARREAL!   ¡COMPARTE EN TU MURO SI A TI TAMBIÉN!       
alegría	Hoy veo Spiderman 
confianza	Me dió nostalgia Ayer recordando con las muchachas lo felices que éramos en ese 2019 
no sabe	Los muchachos ya empezaron con la cantidad de casos nuevos,en breve van a pedir cuarentena obligatoria y renta básica,otra vez      
